title,link,category,published_time
Perplexity CEO says its browser will track everything users do online to sell ‘hyper personalized’ ads,https://techcrunch.com/2025/04/24/perplexity-ceo-says-its-browser-will-track-everything-users-do-online-to-sell-hyper-personalized-ads/,,
xAI adds a ‘memory’ feature to Grok,https://techcrunch.com/2025/04/16/xai-adds-a-memory-feature-to-grok/,AI,"Apr 16, 2025"
Zoom restores service after an hours-long outage,https://techcrunch.com/2025/04/16/zoom-restores-service-after-an-hours-long-outage/,,"Apr 16, 2025"
"Chapter, a Medicare startup with links to Vance, Thiel, and Ramaswamy, just raised a round at $1.5B valuation",https://techcrunch.com/2025/04/16/chapter-a-medicare-startup-with-links-to-vance-thiel-and-ramaswamy-just-raised-a-round-at-1-5b-valuation/,,"Apr 16, 2025"
Trump administration reportedly considers a US DeepSeek ban,https://techcrunch.com/2025/04/16/trump-administration-reportedly-considers-a-us-deepseek-ban/,,"Apr 16, 2025"
Rippling wants Revolut to reveal who paid off Deel’s alleged ‘spy’,https://techcrunch.com/2025/04/16/rippling-wants-uk-fintech-revolut-to-reveal-who-paid-off-deels-alleged-spy/,Startups,"Apr 16, 2025"
Former CISA director Chris Krebs vows to fight back against Trump-ordered federal investigation,https://techcrunch.com/2025/04/16/former-cisa-director-chris-krebs-vows-to-fight-back-against-trump-ordered-federal-investigation/,,"Apr 16, 2025"
OpenAI’s latest AI models have a new safeguard to prevent biorisks,https://techcrunch.com/2025/04/16/openais-latest-ai-models-have-a-new-safeguard-to-prevent-biorisks/,AI,"Apr 16, 2025"
Zuckerberg: Snapchat would have grown faster if it accepted $6B buyout offer,https://techcrunch.com/2025/04/16/zuckerberg-snapchat-would-have-grown-faster-if-it-accepted-6b-buyout-offer/,,"Apr 16, 2025"
Trump-appointed judge orders Trump admin to ‘turn the funding spigots back on’,https://techcrunch.com/2025/04/16/trump-appointed-judge-orders-trump-admin-to-turn-the-funding-spigots-back-on/,Climate,"Apr 16, 2025"
"OpenAI is reportedly in talks to buy Windsurf for $3B, with news expected later this week",https://techcrunch.com/2025/04/16/openai-is-reportedly-in-talks-to-buy-windsurf-for-3b-with-news-expected-later-this-week/,AI,"Apr 16, 2025"
Rivian’s first non-Amazon van customer is HelloFresh,https://techcrunch.com/2025/04/16/rivians-first-non-amazon-van-customer-is-hellofresh/,Transportation,"Apr 16, 2025"
Apple says zero-day bugs exploited against ‘specific targeted individuals’ using iOS,https://techcrunch.com/2025/04/16/apple-says-zero-day-bugs-exploited-against-specific-targeted-individuals-using-ios/,Security,"Apr 16, 2025"
OpenAI partner says it had relatively little time to test the company’s o3 AI model,https://techcrunch.com/2025/04/16/openai-partner-says-it-had-relatively-little-time-to-test-the-companys-new-ai-models/,AI,"Apr 16, 2025"
India’s Uber-rival BluSmart appears to suspend service in wake of EV loan probe,https://techcrunch.com/2025/04/16/indias-uber-rival-blusmart-appears-to-suspend-service-in-wake-of-ev-loan-probe/,Transportation,"Apr 16, 2025"
"OpenAI launches a pair of AI reasoning models, o3 and o4-mini",https://techcrunch.com/2025/04/16/openai-launches-a-pair-of-ai-reasoning-models-o3-and-o4-mini/,AI,"Apr 16, 2025"
"OpenAI debuts Codex CLI, an open source coding tool for terminals",https://techcrunch.com/2025/04/16/openai-debuts-codex-cli-an-open-source-coding-tool-for-terminals/,AI,"Apr 16, 2025"
"Digital frame maker Aura introduces the Aspen, a $229 frame with more intelligent features",https://techcrunch.com/2025/04/16/digital-frame-maker-aura-introduces-the-aspen-a-229-frame-with-more-intelligent-features/,Gadgets,"Apr 16, 2025"
"Bluesky feed builder Graze raises $1M, rolls out ads",https://techcrunch.com/2025/04/16/bluesky-feed-builder-graze-raises-1m-rolls-out-ads/,Social,"Apr 16, 2025"
Apple races to surpass rivals in quest to eliminate carbon pollution,https://techcrunch.com/2025/04/16/apple-races-to-surpass-rivals-in-quest-to-eliminate-carbon-pollution/,Climate,"Apr 16, 2025"
We’ve entered an era of fintech maximalism according to Mark Goldberg,https://techcrunch.com/podcast/weve-entered-an-era-of-fintech-maximalism-according-to-mark-goldberg/,Startups,"Apr 16, 2025"
Google will stop supporting early Nest thermostats on October 25,https://techcrunch.com/2025/04/26/google-will-stop-supporting-early-nest-thermostats-on-october-25/,,
The OpenAI mafia: 15 of the most notable startups founded by alumni,https://techcrunch.com/2025/04/26/the-openai-mafia-15-of-the-most-notable-startups-founded-by-alumni/,,
Musk’s xAI Holdings is reportedly raising the second-largest private funding round ever,https://techcrunch.com/2025/04/25/musks-xai-holdings-is-reportedly-raising-the-second-largest-private-funding-round-ever/,,
An OpenAI researcher who worked on GPT-4.5 had their green card denied,https://techcrunch.com/2025/04/25/an-openai-researcher-who-worked-on-gpt-4-5-had-their-green-card-denied/,,
Bezos-backed Slate Auto debuts analog EV pickup truck that is decidedly anti-Tesla,https://techcrunch.com/2025/04/24/bezos-backed-slate-auto-debuts-analog-ev-pickup-truck-that-is-decidedly-anti-tesla/,,
"Wait, how did a decentralized service like Bluesky go down?",https://techcrunch.com/2025/04/24/wait-how-did-a-decentralized-service-like-bluesky-go-down/,,
Perplexity CEO says its browser will track everything users do online to sell ‘hyper personalized’ ads,https://techcrunch.com/2025/04/24/perplexity-ceo-says-its-browser-will-track-everything-users-do-online-to-sell-hyper-personalized-ads/,,
"Digital frame maker Aura introduces the Aspen, a $229 frame with more intelligent features",https://techcrunch.com/2025/04/16/digital-frame-maker-aura-introduces-the-aspen-a-229-frame-with-more-intelligent-features/,Gadgets,"Apr 16, 2025"
"Bluesky feed builder Graze raises $1M, rolls out ads",https://techcrunch.com/2025/04/16/bluesky-feed-builder-graze-raises-1m-rolls-out-ads/,Social,"Apr 16, 2025"
Apple races to surpass rivals in quest to eliminate carbon pollution,https://techcrunch.com/2025/04/16/apple-races-to-surpass-rivals-in-quest-to-eliminate-carbon-pollution/,Climate,"Apr 16, 2025"
We’ve entered an era of fintech maximalism according to Mark Goldberg,https://techcrunch.com/podcast/weve-entered-an-era-of-fintech-maximalism-according-to-mark-goldberg/,Startups,"Apr 16, 2025"
Kia is pitching Americans an affordable EV sedan with EV4 debut,https://techcrunch.com/2025/04/16/kia-is-pitching-americans-an-affordable-ev-sedan-with-ev4-debut/,Transportation,"Apr 16, 2025"
Startup funding hit records in Q1. But the outlook for 2025 is still awful.,https://techcrunch.com/2025/04/16/startup-funding-hit-records-in-q1-but-the-outlook-for-2025-is-still-awful/,Venture,"Apr 16, 2025"
Microsoft researchers say they’ve developed a hyper-efficient AI model that can run on CPUs,https://techcrunch.com/2025/04/16/microsoft-researchers-say-theyve-developed-a-hyper-efficient-ai-model-that-can-run-on-cpus/,AI,"Apr 16, 2025"
"NSO lawyer names Mexico, Saudi Arabia, and Uzbekistan as spyware customers accused of 2019 WhatsApp hacks",https://techcrunch.com/2025/04/16/nso-lawyer-names-mexico-saudi-arabia-and-uzbekistan-as-spyware-customers-accused-of-2019-whatsapp-hacks/,Security,"Apr 16, 2025"
"As Deezer approaches profitability, it rolls out a custom algorithm and other new features",https://techcrunch.com/2025/04/16/as-deezer-approaches-profitability-it-rolls-out-a-custom-algorithm-and-other-new-features/,Apps,"Apr 16, 2025"
"TikTok begins testing Footnotes, a new Community Notes-like feature",https://techcrunch.com/2025/04/16/tiktok-begins-testing-footnotes-a-new-community-notes-like-feature/,Apps,"Apr 16, 2025"
Deck raises $12M to ‘Plaid-ify’ any website using AI,https://techcrunch.com/2025/04/16/deck-raises-12m-to-plaid-ify-any-website-using-ai/,Startups,"Apr 16, 2025"
TechCrunch All Stage: Full agenda revealed,https://techcrunch.com/2025/04/16/techcrunch-all-stage-full-agenda-revealed/,TechCrunch All Stage 2025,"Apr 16, 2025"
"TS Anil, CEO of Monzo, is joining our StrictlyVC London lineup",https://techcrunch.com/2025/04/16/ts-anil-ceo-of-monzo-is-joining-our-strictlyvc-london-lineup/,StrictlyVC London 2025,"Apr 16, 2025"
"Bolt’s Ryan Breslow pins his hopes on a new app that takes on Coinbase, Zelle, and PayPal",https://techcrunch.com/2025/04/16/bolts-ryan-breslow-pins-his-hopes-on-a-new-app-that-takes-on-coinbase-zelle-and-paypal/,Startups,"Apr 16, 2025"
Less than a month left to claim your brand’s spotlight at TechCrunch Sessions: AI with an exhibit table,https://techcrunch.com/2025/04/16/less-than-a-month-left-to-claim-your-brands-spotlight-at-techcrunch-sessions-ai-with-an-exhibit-table/,TC Sessions: AI,"Apr 16, 2025"
Capsule captures $12M to build the next version of its AI video editor for brands,https://techcrunch.com/2025/04/16/capsule-captures-12m-to-build-the-next-version-of-its-ai-video-editor-for-brands/,Startups,"Apr 16, 2025"
"Subaru debuts Trailseeker, an all-electric SUV coming for Rivian’s outdoorsy EV customer base",https://techcrunch.com/2025/04/16/subaru-debuts-trailseeker-an-all-electric-suv-coming-for-rivians-outdoorsy-ev-customer-base/,Transportation,"Apr 16, 2025"
Lyft to buy taxi app FREENOW for $197M to enter Europe,https://techcrunch.com/2025/04/16/lyft-to-buy-taxi-app-freenow-for-197m-to-enter-europe/,Transportation,"Apr 16, 2025"
AMD expects $800M charge due to US’ license requirement for AI chips,https://techcrunch.com/2025/04/16/amd-takes-800m-charge-on-us-license-requirement-for-ai-chips/,Government & Policy,"Apr 16, 2025"
Patreon tests a native live video feature where creators can stream 24/7,https://techcrunch.com/2025/04/16/patreon-tests-a-native-live-video-feature-where-creators-can-stream-24-7/,Social,"Apr 16, 2025"
Google’s DeepMind UK team reportedly seeks to unionize,https://techcrunch.com/2025/04/26/googles-deepmind-uk-team-reportedly-seeks-to-unionize/,,
Google will stop supporting early Nest thermostats on October 25,https://techcrunch.com/2025/04/26/google-will-stop-supporting-early-nest-thermostats-on-october-25/,,
The OpenAI mafia: 15 of the most notable startups founded by alumni,https://techcrunch.com/2025/04/26/the-openai-mafia-15-of-the-most-notable-startups-founded-by-alumni/,,
An OpenAI researcher who worked on GPT-4.5 had their green card denied,https://techcrunch.com/2025/04/25/an-openai-researcher-who-worked-on-gpt-4-5-had-their-green-card-denied/,,
Bezos-backed Slate Auto debuts analog EV pickup truck that is decidedly anti-Tesla,https://techcrunch.com/2025/04/24/bezos-backed-slate-auto-debuts-analog-ev-pickup-truck-that-is-decidedly-anti-tesla/,,
"Wait, how did a decentralized service like Bluesky go down?",https://techcrunch.com/2025/04/24/wait-how-did-a-decentralized-service-like-bluesky-go-down/,,
Perplexity CEO says its browser will track everything users do online to sell ‘hyper personalized’ ads,https://techcrunch.com/2025/04/24/perplexity-ceo-says-its-browser-will-track-everything-users-do-online-to-sell-hyper-personalized-ads/,,
Google used AI to suspend over 39M ad accounts suspected of fraud,https://techcrunch.com/2025/04/16/google-used-ai-to-suspend-over-39m-ad-accounts-committing-fraud/,Government & Policy,"Apr 16, 2025"
"Visa-backed African unicorn Moniepoint tackles remittances, but is it late to the game?",https://techcrunch.com/2025/04/16/visa-backed-african-unicorn-moniepoint-tackles-remittances-but-is-it-late-to-the-game/,Fintech,"Apr 16, 2025"
Opera adds its Aria AI assistant to Opera Mini on Android,https://techcrunch.com/2025/04/16/opera-adds-its-aria-ai-assistant-to-opera-mini-browser/,Apps,"Apr 16, 2025"
How Musk manages his growing family: WSJ,https://techcrunch.com/2025/04/15/how-musk-manages-his-growing-family-wsj/,,"Apr 15, 2025"
Grok gains a canvas-like tool for creating docs and apps,https://techcrunch.com/2025/04/15/grok-gains-a-canvas-like-tool-for-creating-docs-and-apps/,AI,"Apr 15, 2025"
Nvidia H20 chip exports hit with license requirement by US government,https://techcrunch.com/2025/04/15/nvidia-h20-chip-exports-hit-with-license-requirement-by-us-government/,Enterprise,"Apr 15, 2025"
"Figma ignores the fear, files paperwork for an IPO",https://techcrunch.com/2025/04/15/figma-ignores-the-fear-files-paperwork-for-an-ipo/,Startups,"Apr 15, 2025"
"Telli, a YC alum, raises pre-seed funding for its AI voice agents",https://techcrunch.com/2025/04/15/telli-a-yc-alum-raises-pre-seed-funding-for-its-ai-voice-agents/,Fundraising,"Apr 15, 2025"
"For security, Android phones will now auto-reboot after three days",https://techcrunch.com/2025/04/15/for-security-android-phones-will-now-auto-reboot-after-three-days/,Security,"Apr 15, 2025"
TikTok takes on Google Maps by surfacing reviews in the comments tab,https://techcrunch.com/2025/04/15/tiktok-takes-on-google-maps-by-surfacing-reviews-in-the-comments-tab/,Apps,"Apr 15, 2025"
Stop doomscrolling and watch the ‘Great Moose Migration’ livestream,https://techcrunch.com/2025/04/15/stop-doomscrolling-and-watch-the-great-moose-migration-livestream/,Media & Entertainment,"Apr 15, 2025"
OpenAI may ‘adjust’ its safeguards if rivals release ‘high-risk’ AI,https://techcrunch.com/2025/04/15/openai-says-it-may-adjust-its-safety-requirements-if-a-rival-lab-releases-high-risk-ai/,AI,"Apr 15, 2025"
India’s BluSmart swept up in Gensol investigation alleging misuse of EV loans,https://techcrunch.com/2025/04/15/indian-ride-hailing-startup-blusmart-swept-up-in-gensol-investigation-alleging-misuse-of-ev-loans/,Transportation,"Apr 15, 2025"
Figma sent a cease-and-desist letter to Lovable over the term ‘Dev Mode’,https://techcrunch.com/2025/04/15/figma-sent-a-cease-and-desist-letter-to-lovable-over-the-term-dev-mode/,Startups,"Apr 15, 2025"
OpenAI hires team behind GV-backed AI eval platform Context.ai,https://techcrunch.com/2025/04/15/openai-hires-team-behind-gv-backed-ai-eval-platform-context-ai/,AI,"Apr 15, 2025"
Google bets on geothermal to power data centers in Taiwan,https://techcrunch.com/2025/04/15/google-bets-on-geothermal-to-power-data-centers-in-taiwan/,,"Apr 15, 2025"
Anthropic forms a new team to grow its AWS business,https://techcrunch.com/2025/04/15/anthropic-forms-a-new-team-to-grow-its-aws-business/,AI,"Apr 15, 2025"
Hans Swildens of Industry Ventures on the ways VCs are ‘manufacturing’ liquidity in 2025,https://techcrunch.com/podcast/hans-swildens-of-industry-ventures-on-the-ways-vcs-are-manufacturing-liquidity-in-2025/,Venture,"Apr 15, 2025"
Publishing platform Medium says it’s sticking with DEI,https://techcrunch.com/2025/04/15/publishing-platform-medium-says-its-sticking-with-dei/,Media & Entertainment,"Apr 15, 2025"
Google’s Veo 2 video generating model comes to Gemini,https://techcrunch.com/2025/04/15/googles-veo-2-video-generator-comes-to-gemini/,AI,"Apr 15, 2025"
Google will stop supporting early Nest thermostats on October 25,https://techcrunch.com/2025/04/26/google-will-stop-supporting-early-nest-thermostats-on-october-25/,,
The OpenAI mafia: 15 of the most notable startups founded by alumni,https://techcrunch.com/2025/04/26/the-openai-mafia-15-of-the-most-notable-startups-founded-by-alumni/,,
Musk’s xAI Holdings is reportedly raising the second-largest private funding round ever,https://techcrunch.com/2025/04/25/musks-xai-holdings-is-reportedly-raising-the-second-largest-private-funding-round-ever/,,
An OpenAI researcher who worked on GPT-4.5 had their green card denied,https://techcrunch.com/2025/04/25/an-openai-researcher-who-worked-on-gpt-4-5-had-their-green-card-denied/,,
Bezos-backed Slate Auto debuts analog EV pickup truck that is decidedly anti-Tesla,https://techcrunch.com/2025/04/24/bezos-backed-slate-auto-debuts-analog-ev-pickup-truck-that-is-decidedly-anti-tesla/,,
"Wait, how did a decentralized service like Bluesky go down?",https://techcrunch.com/2025/04/24/wait-how-did-a-decentralized-service-like-bluesky-go-down/,,
Perplexity CEO says its browser will track everything users do online to sell ‘hyper personalized’ ads,https://techcrunch.com/2025/04/24/perplexity-ceo-says-its-browser-will-track-everything-users-do-online-to-sell-hyper-personalized-ads/,,
Anthropic forms a new team to grow its AWS business,https://techcrunch.com/2025/04/15/anthropic-forms-a-new-team-to-grow-its-aws-business/,AI,"Apr 15, 2025"
Hans Swildens of Industry Ventures on the ways VCs are ‘manufacturing’ liquidity in 2025,https://techcrunch.com/podcast/hans-swildens-of-industry-ventures-on-the-ways-vcs-are-manufacturing-liquidity-in-2025/,Venture,"Apr 15, 2025"
Publishing platform Medium says it’s sticking with DEI,https://techcrunch.com/2025/04/15/publishing-platform-medium-says-its-sticking-with-dei/,Media & Entertainment,"Apr 15, 2025"
Google’s Veo 2 video generating model comes to Gemini,https://techcrunch.com/2025/04/15/googles-veo-2-video-generator-comes-to-gemini/,AI,"Apr 15, 2025"
Anthropic’s Claude can now read your Gmail,https://techcrunch.com/2025/04/15/anthropics-claude-now-read-your-gmail/,AI,"Apr 15, 2025"
Notorious image board 4chan hacked and internal data leaked,https://techcrunch.com/2025/04/15/notorious-image-board-4chan-hacked-and-internal-data-leaked/,Security,"Apr 15, 2025"
"Deel’s CEO is now in Dubai, complicating Rippling’s lawsuit",https://techcrunch.com/2025/04/15/deels-ceo-is-now-in-dubai-complicating-ripplings-lawsuit/,Startups,"Apr 15, 2025"
Witness a dynamic dialogue between two visionary CEOs,https://techcrunch.com/2025/04/15/witness-a-dynamic-dialogue-between-two-visionary-ceos/,AI,"Apr 15, 2025"
OpenAI is reportedly developing its own X-like social media platform,https://techcrunch.com/2025/04/15/openai-is-reportedly-developing-its-own-x-like-social-media-platform/,,"Apr 15, 2025"
OpenAI ships GPT-4.1 without a safety report,https://techcrunch.com/2025/04/15/openai-ships-gpt-4-1-without-a-safety-report/,AI,"Apr 15, 2025"
"Former Tesla supply chain leaders create Atomic, an AI inventory solution",https://techcrunch.com/2025/04/15/former-tesla-supply-chain-leaders-create-atomic-an-ai-inventory-solution/,Venture,"Apr 15, 2025"
Here’s how Pacific Fusion plans to build a fusion power plant,https://techcrunch.com/2025/04/15/heres-how-pacific-fusion-plans-to-build-a-fusion-power-plant/,Climate,"Apr 15, 2025"
Founders Fund’s new $4.6B fund indicates an era of big VC spending,https://techcrunch.com/2025/04/15/founders-funds-new-4-6b-fund-indicates-an-era-of-big-vc-spending/,,"Apr 15, 2025"
Mark Zuckerberg once considered deleting all your Facebook friends,https://techcrunch.com/2025/04/15/mark-zuckerberg-once-considered-deleting-all-your-facebook-friends/,Social,"Apr 15, 2025"
Final days to apply to speak at TechCrunch All Stage,https://techcrunch.com/2025/04/15/final-days-to-apply-to-speak-at-techcrunch-all-stage/,TechCrunch All Stage 2025,"Apr 15, 2025"
Notion releases an AI-powered email client for Gmail,https://techcrunch.com/2025/04/15/notion-releases-its-ai-driven-email-inbox/,Enterprise,"Apr 15, 2025"
"Reach 1,000+ AI leaders: Host a Side Event during TechCrunch Sessions: AI",https://techcrunch.com/2025/04/15/host-your-very-own-side-event-during-techcrunch-sessions-ai/,TC Sessions: AI,"Apr 15, 2025"
Lucid Gravity First Drive: An electric SUV that doesn’t make compromises,https://techcrunch.com/2025/04/15/lucid-gravity-first-drive-an-electric-suv-that-doesnt-make-compromises/,,"Apr 15, 2025"
Fusion power has a fuel problem; Hexium has a laser-powered solution,https://techcrunch.com/2025/04/15/fusion-power-has-a-fuel-problem-hexium-has-a-laser-powered-solution/,Climate,"Apr 15, 2025"
Phantom Neuro grabs $19M to help amputees put their phantom limbs to use,https://techcrunch.com/2025/04/15/phantom-neuro-grabs-19m-to-help-amputees-gain-control-of-their-phantom-limbs/,Biotech & Health,"Apr 15, 2025"
Google’s DeepMind UK team reportedly seeks to unionize,https://techcrunch.com/2025/04/26/googles-deepmind-uk-team-reportedly-seeks-to-unionize/,,
Google will stop supporting early Nest thermostats on October 25,https://techcrunch.com/2025/04/26/google-will-stop-supporting-early-nest-thermostats-on-october-25/,,
The OpenAI mafia: 15 of the most notable startups founded by alumni,https://techcrunch.com/2025/04/26/the-openai-mafia-15-of-the-most-notable-startups-founded-by-alumni/,,
An OpenAI researcher who worked on GPT-4.5 had their green card denied,https://techcrunch.com/2025/04/25/an-openai-researcher-who-worked-on-gpt-4-5-had-their-green-card-denied/,,
Bezos-backed Slate Auto debuts analog EV pickup truck that is decidedly anti-Tesla,https://techcrunch.com/2025/04/24/bezos-backed-slate-auto-debuts-analog-ev-pickup-truck-that-is-decidedly-anti-tesla/,,
"Wait, how did a decentralized service like Bluesky go down?",https://techcrunch.com/2025/04/24/wait-how-did-a-decentralized-service-like-bluesky-go-down/,,
Perplexity CEO says its browser will track everything users do online to sell ‘hyper personalized’ ads,https://techcrunch.com/2025/04/24/perplexity-ceo-says-its-browser-will-track-everything-users-do-online-to-sell-hyper-personalized-ads/,,
Apple details how it plans to improve its AI models by privately analyzing user data,https://techcrunch.com/2025/04/15/apple-details-how-it-plans-to-improve-its-ai-models-by-privately-analyzing-user-data/,AI,"Apr 15, 2025"
Waymo and Uber prepare to launch robotaxi service in Atlanta this summer,https://techcrunch.com/2025/04/15/waymo-and-uber-prepare-to-launch-robotaxi-service-in-atlanta-this-summer/,Transportation,"Apr 15, 2025"
"Girls Who Code founder Reshma Saujani spills business tea with Meghan, Duchess of Sussex",https://techcrunch.com/2025/04/15/girls-who-code-founder-reshma-saujani-spills-business-tea-with-meghan-duchess-of-sussex/,Media & Entertainment,"Apr 15, 2025"
"Marshmallow, the UK insurance startup for migrants, raises $90M at a $2B+ valuation",https://techcrunch.com/2025/04/14/marshmallow-the-uk-insurance-startup-for-migrants-raises-90m-at-a-2b-valuation/,Fintech,"Apr 14, 2025"
RLWRLD raises $14.8M to build a foundational model for robotics,https://techcrunch.com/2025/04/14/rlwrld-raises-14-4m-to-build-foundation-model-for-robotics/,Robotics,"Apr 14, 2025"
Debates over AI benchmarking have reached Pokémon,https://techcrunch.com/2025/04/14/debates-over-ai-benchmarking-have-reached-pokemon/,AI,"Apr 14, 2025"
Lime’s scooter and e-bike batteries will be recycled by Redwood Materials,https://techcrunch.com/2025/04/14/limes-scooter-and-ebike-batteries-will-be-recycled-by-redwood-materials/,Transportation,"Apr 14, 2025"
"Rippling is trying to serve Deel’s CEO, but bailiffs can’t find him",https://techcrunch.com/2025/04/14/rippling-is-trying-to-serve-deels-ceo-but-bailiffs-cant-find-him/,,"Apr 14, 2025"
Chinese marketplace DHgate becomes a top US app as trade war intensifies,https://techcrunch.com/2025/04/14/chinese-marketplace-dhgate-becomes-a-top-us-app-as-trade-war-intensifies/,Apps,"Apr 14, 2025"
"Meet Neptune, a TikTok alternative where creators can hide likes and follower counts",https://techcrunch.com/2025/04/14/meet-neptune-a-tiktok-alternative-where-creators-can-hide-likes-and-follower-counts/,Apps,"Apr 14, 2025"
Hertz says customers’ personal data and driver’s licenses stolen in data breach,https://techcrunch.com/2025/04/14/hertz-says-customers-personal-data-and-drivers-licenses-stolen-in-data-breach/,Security,"Apr 14, 2025"
OpenAI’s new GPT-4.1 AI models focus on coding,https://techcrunch.com/2025/04/14/openais-new-gpt-4-1-models-focus-on-coding/,AI,"Apr 14, 2025"
"OpenAI plans to phase out GPT-4.5, its largest-ever AI model, from its API",https://techcrunch.com/2025/04/14/openai-plans-to-wind-down-gpt-4-5-its-largest-ever-ai-model-in-its-api/,AI,"Apr 14, 2025"
Google’s newest AI model is designed to help study dolphin ‘speech’,https://techcrunch.com/2025/04/14/googles-newest-ai-model-is-designed-to-help-study-dolphin-speech/,,"Apr 14, 2025"
Google Classroom gives teachers an AI feature for quiz questions,https://techcrunch.com/2025/04/14/google-classroom-gives-teachers-an-ai-feature-for-quiz-questions/,AI,"Apr 14, 2025"
"Blue Origin’s all-female crew, including Katy Perry, successfully launched",https://techcrunch.com/2025/04/14/blue-origins-all-female-crew-including-katy-perry-successfully-launched/,Space,"Apr 14, 2025"
Chipolo’s newest AirTag competitor works with both Apple and Google’s finding networks,https://techcrunch.com/2025/04/14/chipolos-newest-airtag-competitor-works-with-both-apple-and-googles-finding-networks/,Gadgets,"Apr 14, 2025"
Meta to start training its AI models on public content in the EU,https://techcrunch.com/2025/04/14/meta-to-start-training-its-ai-models-on-public-content-in-the-eu/,AI,"Apr 14, 2025"
Hugging Face buys a humanoid robotics startup,https://techcrunch.com/2025/04/14/hugging-face-buys-a-humanoid-robotics-startup/,,"Apr 14, 2025"
Autonomous trucking startup Kodiak Robotics to go public via SPAC,https://techcrunch.com/2025/04/14/autonomous-trucking-startup-kodiak-robotics-to-go-public-via-spac/,Transportation,"Apr 14, 2025"
Google’s DeepMind UK team reportedly seeks to unionize,https://techcrunch.com/2025/04/26/googles-deepmind-uk-team-reportedly-seeks-to-unionize/,,
Google will stop supporting early Nest thermostats on October 25,https://techcrunch.com/2025/04/26/google-will-stop-supporting-early-nest-thermostats-on-october-25/,,
The OpenAI mafia: 15 of the most notable startups founded by alumni,https://techcrunch.com/2025/04/26/the-openai-mafia-15-of-the-most-notable-startups-founded-by-alumni/,,
An OpenAI researcher who worked on GPT-4.5 had their green card denied,https://techcrunch.com/2025/04/25/an-openai-researcher-who-worked-on-gpt-4-5-had-their-green-card-denied/,,
