title,link,category,published_time
Froda secures $23M Series B for its debt financing platform for SMEs,https://techcrunch.com/2025/04/23/froda-secures-23m-series-b-for-its-debt-financing-platform-for-smes/,Fundraising,4 days ago
Xprize Carbon awarded to a dirt-simple carbon-removal technology,https://techcrunch.com/2025/04/23/xprize-carbon-awarded-to-a-dirt-simple-carbon-removal-technology/,Climate,4 days ago
StrictlyVC heads to Athens for in-depth conversations on European innovation and investment,https://techcrunch.com/2025/04/23/strictlyvc-heads-to-athens-for-in-depth-conversations-on-european-innovation-and-investment/,StrictlyVC Greece,4 days ago
"Tech resilience, breakout startups, and banking reinvented: The big conversations at StrictlyVC London in May",https://techcrunch.com/2025/04/22/how-to-build-resilient-tech-nazo-moosa-of-paladin-talks-cyber-ai-and-deep-tech-at-strictlyvc-london/,StrictlyVC London 2025,4 days ago
Noxtua raises $92M for its sovereign AI tuned for the German legal system,https://techcrunch.com/2025/04/22/noxtua-raises-92m-for-its-sovereign-ai-tuned-for-the-german-legal-system/,Fundraising,4 days ago
"Intel reportedly plans to lay off over 21,000 employees",https://techcrunch.com/2025/04/22/intel-reportedly-plans-to-lay-off-over-21000-employees/,,5 days ago
Meta’s Oversight Board seeks details on the company’s new hate speech policies,https://techcrunch.com/2025/04/22/metas-oversight-board-seeks-details-on-new-hate-speech-policies/,Social,5 days ago
Tesla profits drop 71% on weak sales and anti-Elon Musk sentiment,https://techcrunch.com/2025/04/22/tesla-profits-drop-71-on-weak-sales-and-anti-elon-musk-sentiment/,Transportation,5 days ago
xAI’s Grok chatbot can now ‘see’ the world around it,https://techcrunch.com/2025/04/22/xais-grok-chatbot-can-now-see-the-world-around-it/,AI,5 days ago
Why OpenAI wanted to buy Cursor but opted for the fast-growing Windsurf,https://techcrunch.com/2025/04/22/why-openai-wanted-to-buy-cursor-but-opted-for-the-fast-growing-windsurf/,Startups,"Apr 22, 2025"
ChatGPT’s responses will now include Washington Post articles,https://techcrunch.com/2025/04/22/chatgpts-responses-will-now-include-washington-post-articles/,,"Apr 22, 2025"
Elon Musk says he may keep doing DOGE work for ‘the remainder’ of Trump’s term,https://techcrunch.com/2025/04/22/elon-musk-says-he-may-keep-doing-doge-work-for-the-remainder-of-trumps-term/,Transportation,"Apr 22, 2025"
OpenAI exec says the firm would buy Google’s Chrome browser if offered the chance,https://techcrunch.com/2025/04/22/openai-exec-says-the-company-would-buy-googles-chrome-browser-if-offered-the-chance/,,"Apr 22, 2025"
A Chinese AI video startup appears to be blocking politically sensitive images,https://techcrunch.com/2025/04/22/a-chinese-ai-video-startup-appears-to-be-blocking-politically-sensitive-images/,AI,"Apr 22, 2025"
"Tesla earnings wrap up: Elon Musk talks DOGE, Trump and tariffs, robotaxis, AI, and cheap EVs",https://techcrunch.com/storyline/tesla-q1-earnings-live-updates/,Transportation,"Apr 22, 2025"
Tesla earnings Q1 2025: What we’re watching for,https://techcrunch.com/2025/04/22/tesla-earnings-q1-2025-what-were-watching-for/,Transportation,"Apr 22, 2025"
"Khloe Kardashian launches consumer brand backed by Serena Ventures, WME",https://techcrunch.com/2025/04/22/khloe-kardashian-launches-consumer-brand-backed-by-serena-ventures-wme/,Startups,"Apr 22, 2025"
Vibe coding helps Supabase nab $200M at $2B valuation just seven months after its last raise,https://techcrunch.com/2025/04/22/vibe-coding-helps-supabase-nab-200m-at-2b-valuation-just-seven-months-after-its-last-raise/,Startups,"Apr 22, 2025"
Google’s DeepMind UK team reportedly seeks to unionize,https://techcrunch.com/2025/04/26/googles-deepmind-uk-team-reportedly-seeks-to-unionize/,,
Google will stop supporting early Nest thermostats on October 25,https://techcrunch.com/2025/04/26/google-will-stop-supporting-early-nest-thermostats-on-october-25/,,
The OpenAI mafia: 15 of the most notable startups founded by alumni,https://techcrunch.com/2025/04/26/the-openai-mafia-15-of-the-most-notable-startups-founded-by-alumni/,,
An OpenAI researcher who worked on GPT-4.5 had their green card denied,https://techcrunch.com/2025/04/25/an-openai-researcher-who-worked-on-gpt-4-5-had-their-green-card-denied/,,
Bezos-backed Slate Auto debuts analog EV pickup truck that is decidedly anti-Tesla,https://techcrunch.com/2025/04/24/bezos-backed-slate-auto-debuts-analog-ev-pickup-truck-that-is-decidedly-anti-tesla/,,
"Wait, how did a decentralized service like Bluesky go down?",https://techcrunch.com/2025/04/24/wait-how-did-a-decentralized-service-like-bluesky-go-down/,,
Perplexity CEO says its browser will track everything users do online to sell ‘hyper personalized’ ads,https://techcrunch.com/2025/04/24/perplexity-ceo-says-its-browser-will-track-everything-users-do-online-to-sell-hyper-personalized-ads/,,
Burning questions (and some answers) about Bluesky’s new verification system,https://techcrunch.com/2025/04/22/burning-questions-and-some-answers-about-blueskys-new-verification-system/,Social,"Apr 22, 2025"
Meta releases its CapCut rival Edits globally,https://techcrunch.com/2025/04/22/meta-releases-its-capcut-rival-edits-globally/,Apps,"Apr 22, 2025"
The RealReal founder Julie Wainwright has written a memoir —and an entrepreneurial survival guide,https://techcrunch.com/podcast/the-realreal-founder-julie-wainwright-has-written-a-memoir-and-an-entrepreneurial-survival-guide/,Startups,"Apr 22, 2025"
Ex-Meta engineer raises $14M to help home services unlock call center revenue with AI,https://techcrunch.com/2025/04/22/ex-meta-engineer-raises-14m-for-lace-an-ai-powered-revenue-generation-software-startup/,Startups,"Apr 22, 2025"
"India’s EV startup Ather cuts IPO size to $308M, seeking $1.4B post-money valuation",https://techcrunch.com/2025/04/22/indias-ev-startup-ather-cuts-ipo-size-to-308m-seeking-1-4b-post-money-valuation/,Transportation,"Apr 22, 2025"
Two undergrads built an AI speech model to rival NotebookLM,https://techcrunch.com/2025/04/22/two-undergrads-built-an-ai-speech-model-to-rival-notebooklm/,AI,"Apr 22, 2025"
Adaptive Computer wants to reinvent the PC with ‘vibe’ coding for non-programmers,https://techcrunch.com/2025/04/22/adaptive-computer-wants-to-reinvent-the-pc-with-vibe-coding-for-non-programmers/,Startups,"Apr 22, 2025"
Marks & Spencer confirms cybersecurity incident amid ongoing disruption,https://techcrunch.com/2025/04/22/marks-spencer-confirms-cybersecurity-incident-amid-ongoing-disruption/,Security,"Apr 22, 2025"
Uber customers can now earn Delta SkyMiles from rides or deliveries,https://techcrunch.com/2025/04/22/uber-customers-can-now-earn-delta-skymiles-from-rides-or-deliveries/,Transportation,"Apr 22, 2025"
Superpower wants to help people detect and address health issues before symptoms appear,https://techcrunch.com/2025/04/22/superpower-wants-to-help-people-detect-and-address-health-issues-before-symptoms-appear/,Startups,"Apr 22, 2025"
"Crowdsourced AI benchmarks have serious flaws, some experts say",https://techcrunch.com/2025/04/22/crowdsourced-ai-benchmarks-have-serious-flaws-some-experts-say/,AI,"Apr 22, 2025"
"Social media is not wholly terrible for teen mental health, study says",https://techcrunch.com/2025/04/22/social-media-is-not-wholly-terrible-for-teen-mental-health-study-says/,Social,"Apr 22, 2025"
Manychat taps $140M to boost its business messaging platform with AI,https://techcrunch.com/2025/04/22/manychat-taps-140m-to-boost-its-business-messaging-platform-with-ai/,Social,"Apr 22, 2025"
Rivian elects Cohere’s CEO to its board in latest signal the EV maker is bullish on AI,https://techcrunch.com/2025/04/21/rivian-elects-coheres-ceo-to-its-board-in-latest-signal-the-ev-maker-is-bullish-on-ai/,Transportation,"Apr 21, 2025"
Tomorrow: Join Ali Ghodsi and Dario Amodei for a fireside chat,https://techcrunch.com/2025/04/21/tomorrow-join-ali-ghodsi-and-dario-amodei-for-a-fireside-chat/,AI,"Apr 21, 2025"
Columbia student suspended over interview cheating tool raises $5.3M to ‘cheat on everything’,https://techcrunch.com/2025/04/21/columbia-student-suspended-over-interview-cheating-tool-raises-5-3m-to-cheat-on-everything/,Startups,"Apr 21, 2025"
Flipkart to relocate HQ to India ahead of IPO,https://techcrunch.com/2025/04/21/flipkart-to-relocate-hq-to-india-ahead-of-ipo/,Commerce,"Apr 21, 2025"
"ChatGPT search is growing quickly in Europe, OpenAI data suggests",https://techcrunch.com/2025/04/21/chatgpt-search-is-growing-quickly-in-europe-openai-data-suggests/,AI,"Apr 21, 2025"
Mark Zuckerberg once suggested spinning out Instagram as a solution to its ‘cannibalization’ of Facebook,https://techcrunch.com/2025/04/21/mark-zuckerberg-once-suggested-spinning-out-instagram-as-a-solution-to-its-cannibalization-of-facebook/,Social,"Apr 21, 2025"
Feds accuse Uber of charging customers for subscriptions without consent,https://techcrunch.com/2025/04/21/feds-accuse-uber-of-charging-customers-for-subscriptions-without-consent/,Transportation,"Apr 21, 2025"
Google’s DeepMind UK team reportedly seeks to unionize,https://techcrunch.com/2025/04/26/googles-deepmind-uk-team-reportedly-seeks-to-unionize/,,
Google will stop supporting early Nest thermostats on October 25,https://techcrunch.com/2025/04/26/google-will-stop-supporting-early-nest-thermostats-on-october-25/,,
The OpenAI mafia: 15 of the most notable startups founded by alumni,https://techcrunch.com/2025/04/26/the-openai-mafia-15-of-the-most-notable-startups-founded-by-alumni/,,
An OpenAI researcher who worked on GPT-4.5 had their green card denied,https://techcrunch.com/2025/04/25/an-openai-researcher-who-worked-on-gpt-4-5-had-their-green-card-denied/,,
Bezos-backed Slate Auto debuts analog EV pickup truck that is decidedly anti-Tesla,https://techcrunch.com/2025/04/24/bezos-backed-slate-auto-debuts-analog-ev-pickup-truck-that-is-decidedly-anti-tesla/,,
"Wait, how did a decentralized service like Bluesky go down?",https://techcrunch.com/2025/04/24/wait-how-did-a-decentralized-service-like-bluesky-go-down/,,
Perplexity CEO says its browser will track everything users do online to sell ‘hyper personalized’ ads,https://techcrunch.com/2025/04/24/perplexity-ceo-says-its-browser-will-track-everything-users-do-online-to-sell-hyper-personalized-ads/,,
"a16z acqui-hires VC tech podcaster Erik Torenberg, who joins as new partner",https://techcrunch.com/2025/04/21/a16z-acqui-hires-vc-tech-podcaster-erik-torenberg-who-joins-as-new-partner/,Venture,"Apr 21, 2025"
Bluesky launches blue check verification,https://techcrunch.com/2025/04/21/bluesky-launches-blue-check-verification/,Social,"Apr 21, 2025"
Reddit briefly down for users worldwide,https://techcrunch.com/2025/04/21/reddit-briefly-down-for-users-worldwide/,Social,"Apr 21, 2025"
An AI doctoral candidate in California says they had their student visa revoked,https://techcrunch.com/2025/04/21/an-ai-doctoral-candidate-in-california-says-they-had-their-student-visa-revoked/,AI,"Apr 21, 2025"
19 new tech unicorns were minted in 2025 so far,https://techcrunch.com/2025/04/21/7-new-tech-unicorns-were-minted-in-2025-so-far/,Startups,"Apr 21, 2025"
Put your brand at the center of the AI conversation — host a Side Event during TechCrunch Sessions: AI,https://techcrunch.com/2025/04/21/put-your-brand-at-the-center-of-the-ai-conversation-host-a-side-event-during-techcrunch-sessions-ai/,TC Sessions: AI,"Apr 21, 2025"
Final weeks to secure your spot in the AI spotlight at TechCrunch Sessions: AI,https://techcrunch.com/2025/04/21/final-weeks-to-secure-your-spot-in-the-ai-spotlight-at-techcrunch-sessions-ai/,TC Sessions: AI,"Apr 21, 2025"
Instagram is using AI to find teens lying about their age and restricting their accounts,https://techcrunch.com/2025/04/21/instagram-is-using-ai-to-find-teens-lying-about-their-age-and-restricting-their-accounts/,Social,"Apr 21, 2025"
Tesla reportedly delays launch of new low-cost model by months,https://techcrunch.com/2025/04/21/tesla-reportedly-delays-launch-of-new-low-cost-model-by-months/,,"Apr 21, 2025"
Airbnb will now show users the total cost of their stay right away,https://techcrunch.com/2025/04/21/airbnb-will-automatically-display-total-price-to-all-users/,Apps,"Apr 21, 2025"
Palantir exec defends company’s immigration surveillance work,https://techcrunch.com/2025/04/20/palantir-exec-defends-companys-immigration-surveillance-work/,Government & Policy,"Apr 20, 2025"
OpenAI’s o3 AI model scores lower on a benchmark than the company initially implied,https://techcrunch.com/2025/04/20/openais-o3-ai-model-scores-lower-on-a-benchmark-than-the-company-initially-implied/,AI,"Apr 20, 2025"
Kids sure love video game movies,https://techcrunch.com/2025/04/20/kids-sure-love-video-game-movies/,Media & Entertainment,"Apr 20, 2025"
Your politeness could be costly for OpenAI,https://techcrunch.com/2025/04/20/your-politeness-could-be-costly-for-openai/,,"Apr 20, 2025"
Uncovered emails showed how Meta struggled to keep Facebook culturally relevant,https://techcrunch.com/2025/04/20/uncovered-emails-showed-how-meta-struggled-to-keep-facebook-culturally-relevant/,Social,"Apr 20, 2025"
Congress has questions about 23andMe bankruptcy,https://techcrunch.com/2025/04/19/congress-has-questions-about-23andme-bankruptcy/,,"Apr 19, 2025"
"Robots run a half-marathon, slowly",https://techcrunch.com/2025/04/19/robots-run-a-half-marathon-slowly/,Robotics,"Apr 19, 2025"
Week in Review: Google loses a major antitrust case,https://techcrunch.com/2025/04/19/week-in-review-google-loses-a-major-antitrust-case/,Social,"Apr 19, 2025"
Famed AI researcher launches controversial startup to replace all human workers everywhere,https://techcrunch.com/2025/04/19/famed-ai-researcher-launches-controversial-startup-to-replace-all-human-workers-everywhere/,Startups,"Apr 19, 2025"
Read what Mark Zuckerberg and Facebook execs said about Instagram before buying it,https://techcrunch.com/2025/04/19/read-what-mark-zuckerberg-and-facebook-execs-said-about-instagram-before-buying-it/,Social,"Apr 19, 2025"
Google will stop supporting early Nest thermostats on October 25,https://techcrunch.com/2025/04/26/google-will-stop-supporting-early-nest-thermostats-on-october-25/,,
The OpenAI mafia: 15 of the most notable startups founded by alumni,https://techcrunch.com/2025/04/26/the-openai-mafia-15-of-the-most-notable-startups-founded-by-alumni/,,
Musk’s xAI Holdings is reportedly raising the second-largest private funding round ever,https://techcrunch.com/2025/04/25/musks-xai-holdings-is-reportedly-raising-the-second-largest-private-funding-round-ever/,,
An OpenAI researcher who worked on GPT-4.5 had their green card denied,https://techcrunch.com/2025/04/25/an-openai-researcher-who-worked-on-gpt-4-5-had-their-green-card-denied/,,
Bezos-backed Slate Auto debuts analog EV pickup truck that is decidedly anti-Tesla,https://techcrunch.com/2025/04/24/bezos-backed-slate-auto-debuts-analog-ev-pickup-truck-that-is-decidedly-anti-tesla/,,
"Wait, how did a decentralized service like Bluesky go down?",https://techcrunch.com/2025/04/24/wait-how-did-a-decentralized-service-like-bluesky-go-down/,,
Perplexity CEO says its browser will track everything users do online to sell ‘hyper personalized’ ads,https://techcrunch.com/2025/04/24/perplexity-ceo-says-its-browser-will-track-everything-users-do-online-to-sell-hyper-personalized-ads/,,
"Robots run a half-marathon, slowly",https://techcrunch.com/2025/04/19/robots-run-a-half-marathon-slowly/,Robotics,"Apr 19, 2025"
Week in Review: Google loses a major antitrust case,https://techcrunch.com/2025/04/19/week-in-review-google-loses-a-major-antitrust-case/,Social,"Apr 19, 2025"
Famed AI researcher launches controversial startup to replace all human workers everywhere,https://techcrunch.com/2025/04/19/famed-ai-researcher-launches-controversial-startup-to-replace-all-human-workers-everywhere/,Startups,"Apr 19, 2025"
Read what Mark Zuckerberg and Facebook execs said about Instagram before buying it,https://techcrunch.com/2025/04/19/read-what-mark-zuckerberg-and-facebook-execs-said-about-instagram-before-buying-it/,Social,"Apr 19, 2025"
A comprehensive list of 2025 tech layoffs,https://techcrunch.com/2025/04/18/tech-layoffs-2025-list/,Startups,"Apr 18, 2025"
A new kids’ show will come with a crypto wallet when it debuts this fall,https://techcrunch.com/2025/04/18/a-new-kids-show-will-come-with-a-crypto-wallet-when-it-debuts-this-fall/,Media & Entertainment,"Apr 18, 2025"
"Techstars increases startup funding to $220,000, mirroring YC structure",https://techcrunch.com/2025/04/18/techstars-increases-startup-funding-to-220000-mirroring-yc-structure/,Venture,"Apr 18, 2025"
OpenAI’s new reasoning AI models hallucinate more,https://techcrunch.com/2025/04/18/openais-new-reasoning-ai-models-hallucinate-more/,AI,"Apr 18, 2025"
Bluesky may soon add blue check verification,https://techcrunch.com/2025/04/18/bluesky-may-soon-add-blue-check-verification/,Social,"Apr 18, 2025"
"TechCrunch Mobility: Lyft buys its way into Europe, Kodiak SPACs, and how China’s new ADAS rules might affect Tesla",https://techcrunch.com/2025/04/18/techcrunch-mobility-lyft-buys-its-way-into-europe-kodiak-spacs-and-how-chinas-new-adas-rules-might-affect-tesla/,Transportation,"Apr 18, 2025"
White House replaces covid.gov website with ‘lab leak’ theory,https://techcrunch.com/2025/04/18/white-house-replaces-covid-gov-website-with-lab-leak-theory/,,"Apr 18, 2025"
"ChatGPT is referring to users by their names unprompted, and some find it ‘creepy’",https://techcrunch.com/2025/04/18/chatgpt-is-referring-to-users-by-their-names-unprompted-and-some-find-it-creepy/,AI,"Apr 18, 2025"
From Bogotá to the Battlefield: LatAm startups are winning big in TechCrunch Startup Battlefield,https://techcrunch.com/2025/04/18/from-bogota-to-the-battlefield-latam-startups-are-winning-big/,TechCrunch Disrupt 2025,"Apr 18, 2025"
Startups Weekly: Mixed messages from venture capital,https://techcrunch.com/2025/04/18/startups-weekly-mixed-messages-from-venture-capital/,Startups,"Apr 18, 2025"
TikToker sues Roblox over her Charli XCX ‘Apple’ dance,https://techcrunch.com/2025/04/18/tiktoker-sues-roblox-over-her-charli-xcx-apple-dance/,,"Apr 18, 2025"
ChatGPT will now use its ‘memory’ to personalize web searches,https://techcrunch.com/2025/04/18/chatgpt-will-now-use-its-memory-to-personalize-web-searches/,AI,"Apr 18, 2025"
Trump EPA targets two-man geoengineering startup for ‘polluting the air’,https://techcrunch.com/2025/04/18/trump-epa-targets-two-man-geoengineering-startup-for-polluting-the-air/,Climate,"Apr 18, 2025"
Is the SPAC back?,https://techcrunch.com/podcast/is-the-spac-back/,Startups,"Apr 18, 2025"
"The Nintendo Switch 2 will still cost $450 in the US, despite tariffs",https://techcrunch.com/2025/04/18/the-nintendo-switch-2-will-still-cost-450-in-the-us-despite-tariffs/,Gaming,"Apr 18, 2025"
Final day to submit your speaker application and shape the next wave of startups at TechCrunch All Stage,https://techcrunch.com/2025/04/18/final-day-to-submit-your-speaker-application-and-shape-the-next-wave-of-startups-at-techcrunch-all-stage/,TechCrunch All Stage 2025,"Apr 18, 2025"
Google’s DeepMind UK team reportedly seeks to unionize,https://techcrunch.com/2025/04/26/googles-deepmind-uk-team-reportedly-seeks-to-unionize/,,
Google will stop supporting early Nest thermostats on October 25,https://techcrunch.com/2025/04/26/google-will-stop-supporting-early-nest-thermostats-on-october-25/,,
The OpenAI mafia: 15 of the most notable startups founded by alumni,https://techcrunch.com/2025/04/26/the-openai-mafia-15-of-the-most-notable-startups-founded-by-alumni/,,
An OpenAI researcher who worked on GPT-4.5 had their green card denied,https://techcrunch.com/2025/04/25/an-openai-researcher-who-worked-on-gpt-4-5-had-their-green-card-denied/,,
Bezos-backed Slate Auto debuts analog EV pickup truck that is decidedly anti-Tesla,https://techcrunch.com/2025/04/24/bezos-backed-slate-auto-debuts-analog-ev-pickup-truck-that-is-decidedly-anti-tesla/,,
"Wait, how did a decentralized service like Bluesky go down?",https://techcrunch.com/2025/04/24/wait-how-did-a-decentralized-service-like-bluesky-go-down/,,
Perplexity CEO says its browser will track everything users do online to sell ‘hyper personalized’ ads,https://techcrunch.com/2025/04/24/perplexity-ceo-says-its-browser-will-track-everything-users-do-online-to-sell-hyper-personalized-ads/,,
"OpenAI launches Flex processing for cheaper, slower AI tasks",https://techcrunch.com/2025/04/17/openai-launches-flex-processing-for-cheaper-slower-ai-tasks/,AI,"Apr 17, 2025"
Carbon removal startup Holocene bought by oil and gas giant Occidental,https://techcrunch.com/2025/04/17/carbon-removal-startup-holocene-bought-by-oil-and-gas-giant-occidental/,Climate,"Apr 17, 2025"
"As the trade war escalates, Hence launches an AI ‘advisor’ to help companies manage risk",https://techcrunch.com/2025/04/17/as-the-trade-war-escalates-hence-launches-an-ai-advisor-to-help-companies-manage-risk/,AI,"Apr 17, 2025"
Chinese shopping app Taobao joins DHgate in Top 5 on US App Store,https://techcrunch.com/2025/04/17/chinese-shopping-app-taobao-joins-dhgate-in-top-5-on-us-app-store/,Apps,"Apr 17, 2025"
Former Y Combinator president Geoff Ralston launches new AI ‘safety’ fund,https://techcrunch.com/2025/04/17/former-y-combinator-president-geoff-ralston-launches-new-ai-safety-fund/,Venture,"Apr 17, 2025"
"Google’s latest AI model report lacks key safety details, experts say",https://techcrunch.com/2025/04/17/googles-latest-ai-model-report-lacks-key-safety-details-experts-say/,AI,"Apr 17, 2025"
Automakers selling cars in China banned from using ‘autonomous driving’ in ads,https://techcrunch.com/2025/04/17/automakers-selling-cars-in-china-banned-from-using-autonomous-driving-in-ads/,Transportation,"Apr 17, 2025"
AI benchmarking platform Chatbot Arena forms a new company,https://techcrunch.com/2025/04/17/ai-benchmarking-platform-chatbot-arena-forms-a-new-company/,,"Apr 17, 2025"
Florida draft law mandating encryption backdoors for social media accounts billed ‘dangerous and dumb’,https://techcrunch.com/2025/04/17/florida-draft-law-mandating-encryption-backdoors-for-social-media-accounts-billed-dangerous-and-dumb/,Security,"Apr 17, 2025"
Instagram’s new Blend feature creates a custom reels feed for you and your friends,https://techcrunch.com/2025/04/17/instagrams-new-blend-feature-creates-a-custom-reels-feed-for-you-and-your-friends/,Apps,"Apr 17, 2025"
Here are all the tech companies rolling back DEI or still committed to it — so far,https://techcrunch.com/2025/04/17/here-are-all-the-tech-companies-rolling-back-dei-or-still-committed-to-it-so-far/,Government & Policy,"Apr 17, 2025"
OpenAI’s Stargate project sets its sights on international expansion,https://techcrunch.com/2025/04/17/openais-stargate-project-sets-its-sights-on-international-expansion/,,"Apr 17, 2025"
The latest viral ChatGPT trend is doing ‘reverse location search’ from photos,https://techcrunch.com/2025/04/17/the-latest-viral-chatgpt-trend-is-doing-reverse-location-search-from-photos/,AI,"Apr 17, 2025"
"Judge rules Google illegally monopolized adtech, opening door to potential breakup",https://techcrunch.com/2025/04/17/judge-rules-google-illegally-monopolized-ad-tech-opening-door-to-potential-breakup/,Government & Policy,"Apr 17, 2025"
Make a brand impact by hosting a Side Event during TechCrunch All Stage Week in Boston,https://techcrunch.com/2025/04/17/make-a-brand-impact-by-hosting-a-side-event-during-techcrunch-all-stage-week-in-boston/,TechCrunch All Stage 2025,"Apr 17, 2025"
Mark Zuckerberg says TikTok slowed Meta’s growth,https://techcrunch.com/2025/04/17/mark-zuckerberg-says-tiktok-slowed-metas-growth/,Social,"Apr 17, 2025"
Shein and Temu to raise prices for US shoppers in response to tariffs,https://techcrunch.com/2025/04/17/shein-and-temu-to-raise-prices-for-us-shoppers-in-response-to-tariffs/,,"Apr 17, 2025"
Wasp’s platform is the glue that holds web dev apps together,https://techcrunch.com/2025/04/17/wasps-platform-is-the-glue-that-holds-web-apps-together/,Startups,"Apr 17, 2025"
Archer Aviation wants to help New Yorkers skip airport traffic with electric air taxis,https://techcrunch.com/2025/04/17/archer-aviation-wants-to-help-new-yorkers-skip-airport-traffic-with-electric-air-taxis/,Transportation,"Apr 17, 2025"
"Smashing, the reading curation app by Goodreads’ founder, shuts down",https://techcrunch.com/2025/04/16/smashing-the-reading-curation-app-by-goodreads-founder-shuts-down/,Apps,"Apr 16, 2025"
Google will stop supporting early Nest thermostats on October 25,https://techcrunch.com/2025/04/26/google-will-stop-supporting-early-nest-thermostats-on-october-25/,,
The OpenAI mafia: 15 of the most notable startups founded by alumni,https://techcrunch.com/2025/04/26/the-openai-mafia-15-of-the-most-notable-startups-founded-by-alumni/,,
Musk’s xAI Holdings is reportedly raising the second-largest private funding round ever,https://techcrunch.com/2025/04/25/musks-xai-holdings-is-reportedly-raising-the-second-largest-private-funding-round-ever/,,
An OpenAI researcher who worked on GPT-4.5 had their green card denied,https://techcrunch.com/2025/04/25/an-openai-researcher-who-worked-on-gpt-4-5-had-their-green-card-denied/,,
Bezos-backed Slate Auto debuts analog EV pickup truck that is decidedly anti-Tesla,https://techcrunch.com/2025/04/24/bezos-backed-slate-auto-debuts-analog-ev-pickup-truck-that-is-decidedly-anti-tesla/,,
"Wait, how did a decentralized service like Bluesky go down?",https://techcrunch.com/2025/04/24/wait-how-did-a-decentralized-service-like-bluesky-go-down/,,
