title,link,category,published_time
Google will stop supporting early Nest thermostats on October 25,https://techcrunch.com/2025/04/26/google-will-stop-supporting-early-nest-thermostats-on-october-25/,,
The OpenAI mafia: 15 of the most notable startups founded by alumni,https://techcrunch.com/2025/04/26/the-openai-mafia-15-of-the-most-notable-startups-founded-by-alumni/,,
An OpenAI researcher who worked on GPT-4.5 had their green card denied,https://techcrunch.com/2025/04/25/an-openai-researcher-who-worked-on-gpt-4-5-had-their-green-card-denied/,,
Bezos-backed Slate Auto debuts analog EV pickup truck that is decidedly anti-Tesla,https://techcrunch.com/2025/04/24/bezos-backed-slate-auto-debuts-analog-ev-pickup-truck-that-is-decidedly-anti-tesla/,,
"Wait, how did a decentralized service like Bluesky go down?",https://techcrunch.com/2025/04/24/wait-how-did-a-decentralized-service-like-bluesky-go-down/,,
Perplexity CEO says its browser will track everything users do online to sell ‘hyper personalized’ ads,https://techcrunch.com/2025/04/24/perplexity-ceo-says-its-browser-will-track-everything-users-do-online-to-sell-hyper-personalized-ads/,,
"YouTube expands its ‘likeness’ detection technology, which detects AI fakes, to a handful of top creators",https://techcrunch.com/2025/04/09/youtube-expands-its-likeness-detection-technology-which-detects-ai-fakes-to-a-handful-of-top-creators/,AI,"Apr 9, 2025"
"Senator puts hold on Trump’s nominee for CISA director, citing telco security ‘cover up’",https://techcrunch.com/2025/04/09/senator-puts-hold-on-trumps-nominee-for-cisa-director-citing-telco-security-cover-up/,Security,"Apr 9, 2025"
US may fine TSMC $1B over chip allegedly used in Huawei AI processor,https://techcrunch.com/2025/04/09/us-may-fine-tsmc-1b-over-chip-allegedly-used-in-huawei-ai-processor/,Government & Policy,"Apr 9, 2025"
Tired of doing laundry? These startups want to help.,https://techcrunch.com/2025/04/09/tired-of-doing-laundry-these-startups-want-to-help/,Startups,"Apr 9, 2025"
Samsung’s SmartThings app gets more home automation capabilities,https://techcrunch.com/2025/04/09/samsung-smartthings-apps-gets-better-routines-and-intercom-feature-with-the-new-update/,Apps,"Apr 9, 2025"
"Artisan, the ‘stop hiring humans’ AI agent startup, raises $25M — and is still hiring humans",https://techcrunch.com/2025/04/09/artisan-the-stop-hiring-humans-ai-agent-startup-raises-25m-and-is-still-hiring-humans/,Startups,"Apr 9, 2025"
WordPress.com launches a free AI-powered website builder,https://techcrunch.com/2025/04/09/wordpress-com-launches-a-free-ai-powered-website-builder/,AI,"Apr 9, 2025"
Instagram tests locked reels that can be accessed with secret codes,https://techcrunch.com/2025/04/09/instagram-tests-locked-reels-that-can-be-accessed-with-secret-codes/,Apps,"Apr 9, 2025"
Nuro’s $106M raise backs its shift from delivery robots to licensing autonomy tech,https://techcrunch.com/2025/04/09/nuros-106m-raise-backs-its-shift-from-delivery-robots-to-licensing-autonomy-tech/,Transportation,"Apr 9, 2025"
"Solve Intelligence raises fresh $12M to bring AI to IP, patent workflows",https://techcrunch.com/2025/04/09/microsoft-backs-solve-intelligence-in-12m-series-a-funding/,Fundraising,"Apr 9, 2025"
Tessell snags $60M to drive data management at scale,https://techcrunch.com/2025/04/09/tessell-snags-60m-to-drive-data-management-at-scale/,Enterprise,"Apr 9, 2025"
The complete agenda for TechCrunch Sessions: AI unveiled,https://techcrunch.com/2025/04/09/the-complete-agenda-for-techcrunch-sessions-ai-unveiled/,TC Sessions: AI,"Apr 9, 2025"
Ironwood is Google’s newest AI accelerator chip,https://techcrunch.com/2025/04/09/google-unveils-ironwood-a-new-ai-accelerator-chip/,AI,"Apr 9, 2025"
Google’s newest Gemini AI model focuses on efficiency,https://techcrunch.com/2025/04/09/googles-newest-gemini-ai-model-focuses-on-efficiency/,AI,"Apr 9, 2025"
"Google Workspace gets automation flows, podcast-style summaries",https://techcrunch.com/2025/04/09/google-workspace-gets-automation-flows-podcast-style-summaries/,AI,"Apr 9, 2025"
Google’s enterprise cloud gets a music-generating AI model,https://techcrunch.com/2025/04/09/google-brings-a-music-generating-ai-model-to-its-enterprise-cloud/,AI,"Apr 9, 2025"
"Gemini Code Assist, Google’s AI coding assistant, gets ‘agentic’ abilities",https://techcrunch.com/2025/04/09/gemini-code-assist-googles-ai-coding-assistant-gets-agentic-upgrades/,AI,"Apr 9, 2025"
Samsung adds Google’s Gemini to its home robot Ballie,https://techcrunch.com/2025/04/09/samsung-adds-google-gemini-ai-assistant-to-its-home-robot-ballie/,Hardware,"Apr 9, 2025"
Reddit’s conversational AI search tool leverages Google Gemini,https://techcrunch.com/2025/04/09/reddits-conversational-ai-search-tool-leverages-google-gemini/,Social,"Apr 9, 2025"
"Lyst, a fashion marketplace once valued at $700M, sells to Japan’s Zozo for $154M",https://techcrunch.com/2025/04/09/lyst-the-fashion-marketplace-once-valued-at-700m-sells-to-japans-zozo-for-154m/,Commerce,"Apr 9, 2025"
Google’s DeepMind UK team reportedly seeks to unionize,https://techcrunch.com/2025/04/26/googles-deepmind-uk-team-reportedly-seeks-to-unionize/,,
Google will stop supporting early Nest thermostats on October 25,https://techcrunch.com/2025/04/26/google-will-stop-supporting-early-nest-thermostats-on-october-25/,,
The OpenAI mafia: 15 of the most notable startups founded by alumni,https://techcrunch.com/2025/04/26/the-openai-mafia-15-of-the-most-notable-startups-founded-by-alumni/,,
An OpenAI researcher who worked on GPT-4.5 had their green card denied,https://techcrunch.com/2025/04/25/an-openai-researcher-who-worked-on-gpt-4-5-had-their-green-card-denied/,,
Bezos-backed Slate Auto debuts analog EV pickup truck that is decidedly anti-Tesla,https://techcrunch.com/2025/04/24/bezos-backed-slate-auto-debuts-analog-ev-pickup-truck-that-is-decidedly-anti-tesla/,,
"Wait, how did a decentralized service like Bluesky go down?",https://techcrunch.com/2025/04/24/wait-how-did-a-decentralized-service-like-bluesky-go-down/,,
Perplexity CEO says its browser will track everything users do online to sell ‘hyper personalized’ ads,https://techcrunch.com/2025/04/24/perplexity-ceo-says-its-browser-will-track-everything-users-do-online-to-sell-hyper-personalized-ads/,,
Governments identify dozens of Android apps bundled with spyware,https://techcrunch.com/2025/04/09/governments-identify-dozens-of-android-apps-bundled-with-spyware/,Security,"Apr 9, 2025"
A 25-year-old police drone founder just raised $75M led by Index,https://techcrunch.com/2025/04/08/a-25-year-old-police-drone-founder-just-raised-75m-led-by-index/,Startups,"Apr 8, 2025"
Instagram is beefing up its search to compete with TikTok,https://techcrunch.com/2025/04/08/instagram-is-beefing-up-its-search-to-compete-with-tiktok/,Social,"Apr 8, 2025"
Deep Cogito emerges from stealth with hybrid AI ‘reasoning’ models,https://techcrunch.com/2025/04/08/deep-cogito-emerges-from-stealth-with-hybrid-ai-reasoning-models/,AI,"Apr 8, 2025"
"No, Stripe is not becoming a bank",https://techcrunch.com/2025/04/08/no-stripe-is-not-becoming-a-bank/,Fintech,"Apr 8, 2025"
Inside the EV startup secretly backed by Jeff Bezos,https://techcrunch.com/2025/04/08/inside-the-ev-startup-secretly-backed-by-jeff-bezos/,Transportation,"Apr 8, 2025"
"At last, MrBeast weighs in on the global economic crisis du jour",https://techcrunch.com/2025/04/08/at-last-mrbeast-weighs-in-on-the-global-economic-crisis-du-jour/,Social,"Apr 8, 2025"
Does Colossal Biosciences’ dire wolf creation justify its $10B+ valuation?,https://techcrunch.com/2025/04/08/does-colossal-biosciences-dire-wolf-creation-justify-its-10b-valuation/,Biotech & Health,"Apr 8, 2025"
A nonprofit is using AI agents to raise money for charity,https://techcrunch.com/2025/04/08/a-nonprofit-is-using-ai-agents-to-raise-money-for-charity/,AI,"Apr 8, 2025"
Tapestry’s app can now de-dupe your social feeds,https://techcrunch.com/2025/04/08/tapestrys-app-can-now-de-dupe-your-social-feeds/,Apps,"Apr 8, 2025"
Google fixes two Android zero-day bugs actively exploited by hackers,https://techcrunch.com/2025/04/08/google-fixes-two-android-zero-day-bugs-actively-exploited-by-hackers/,Security,"Apr 8, 2025"
Take the stage at TechCrunch Disrupt 2025: Apply to speak now,https://techcrunch.com/2025/04/08/take-the-stage-at-techcrunch-disrupt-2025-apply-to-speak-now/,TechCrunch Disrupt 2025,"Apr 8, 2025"
Amazon’s Zoox begins robotaxi testing in Los Angeles,https://techcrunch.com/2025/04/08/amazons-zoox-begins-robotaxi-testing-in-los-angeles/,Transportation,"Apr 8, 2025"
Los Angeles-based Rain raised a $75M Series B in another good sign for fintech,https://techcrunch.com/2025/04/08/los-angeles-based-rain-raised-a-75m-series-b-in-another-good-sign-for-fintech/,Fintech,"Apr 8, 2025"
"Founders, TechCrunch Startup Battlefield 200 is calling! Apply to enter!",https://techcrunch.com/2025/04/08/founders-techcrunch-startup-battlefield-200-is-calling-apply-to-enter/,TechCrunch Disrupt 2025,"Apr 8, 2025"
Trump to endorse coal for data center power in the face of grim market realities,https://techcrunch.com/2025/04/08/trump-to-endorse-coal-for-data-center-power-in-the-face-of-grim-market-realities/,Climate,"Apr 8, 2025"
Volunteer your time for a free ticket to TechCrunch Sessions: AI,https://techcrunch.com/2025/04/08/volunteer-your-time-for-a-free-ticket-to-techcrunch-sessions-ai/,TC Sessions: AI,"Apr 8, 2025"
"Waymo may use interior camera data to train generative AI models, but riders will be able to opt out",https://techcrunch.com/2025/04/08/waymo-may-use-interior-camera-data-to-train-generative-ai-models-sell-ads/,Transportation,"Apr 8, 2025"
Meet the new Audience Choice winners to lead breakouts at TechCrunch Sessions: AI,https://techcrunch.com/2025/04/08/meet-the-new-audience-choice-winners-to-lead-breakouts-at-techcrunch-sessions-ai/,TC Sessions: AI,"Apr 8, 2025"
Mira Murati’s AI startup gains prominent ex-OpenAI advisers,https://techcrunch.com/2025/04/08/mira-muratis-ai-startup-gains-prominent-ex-openai-advisers/,AI,"Apr 8, 2025"
Google’s DeepMind UK team reportedly seeks to unionize,https://techcrunch.com/2025/04/26/googles-deepmind-uk-team-reportedly-seeks-to-unionize/,,
Google will stop supporting early Nest thermostats on October 25,https://techcrunch.com/2025/04/26/google-will-stop-supporting-early-nest-thermostats-on-october-25/,,
The OpenAI mafia: 15 of the most notable startups founded by alumni,https://techcrunch.com/2025/04/26/the-openai-mafia-15-of-the-most-notable-startups-founded-by-alumni/,,
An OpenAI researcher who worked on GPT-4.5 had their green card denied,https://techcrunch.com/2025/04/25/an-openai-researcher-who-worked-on-gpt-4-5-had-their-green-card-denied/,,
Bezos-backed Slate Auto debuts analog EV pickup truck that is decidedly anti-Tesla,https://techcrunch.com/2025/04/24/bezos-backed-slate-auto-debuts-analog-ev-pickup-truck-that-is-decidedly-anti-tesla/,,
"Wait, how did a decentralized service like Bluesky go down?",https://techcrunch.com/2025/04/24/wait-how-did-a-decentralized-service-like-bluesky-go-down/,,
Perplexity CEO says its browser will track everything users do online to sell ‘hyper personalized’ ads,https://techcrunch.com/2025/04/24/perplexity-ceo-says-its-browser-will-track-everything-users-do-online-to-sell-hyper-personalized-ads/,,
Snapchat rolls out Sponsored AI Lenses for brands,https://techcrunch.com/2025/04/08/snapchat-rolls-out-sponsored-ai-lenses-for-brands/,AI,"Apr 8, 2025"
"Amazon unveils a new AI voice model, Nova Sonic",https://techcrunch.com/2025/04/08/amazon-unveils-a-new-ai-voice-model-nova-sonic/,AI,"Apr 8, 2025"
Blackbird gobbles up $50M for its blockchain-based payment-loyalty app for restaurants,https://techcrunch.com/2025/04/08/blackbird-gobbles-up-50m-for-its-blockchain-based-payment-loyalty-app-for-restaurants/,Fundraising,"Apr 8, 2025"
XL Batteries is using petrochemical infrastructure to store solar and wind power,https://techcrunch.com/2025/04/08/xl-batteries-is-using-petrochemical-infrastructure-to-store-solar-and-wind-power/,Climate,"Apr 8, 2025"
Sizl raises $3.5M to expand its cook-to-order food delivery service,https://techcrunch.com/2025/04/08/sizl-raises-3-5m-to-expand-its-cook-to-order-food-delivery-service/,Startups,"Apr 8, 2025"
Meta introduces restricted Teen Accounts to Facebook and Messenger,https://techcrunch.com/2025/04/08/meta-introduces-restricted-teen-accounts-to-facebook-and-messenger/,Apps,"Apr 8, 2025"
Turkey’s Sipay raises $78M to expand its Stripe-like services into emerging markets,https://techcrunch.com/2025/04/08/turkeys-sipay-raises-78m-to-expand-its-stripe-like-services-into-emerging-markets/,Fintech,"Apr 8, 2025"
Apple might import more iPhones from India to sidestep China tariffs,https://techcrunch.com/2025/04/08/apple-might-import-more-iphones-from-india-to-side-step-china-tariffs/,,"Apr 8, 2025"
IBM releases a new mainframe built for the age of AI,https://techcrunch.com/2025/04/07/ibm-releases-a-new-mainframe-built-for-the-age-of-ai/,Enterprise,"Apr 7, 2025"
Google is allegedly paying some AI staff to do nothing for a year rather than join rivals,https://techcrunch.com/2025/04/07/google-is-allegedly-paying-some-ai-staff-to-do-nothing-for-a-year-rather-than-join-rivals/,,"Apr 7, 2025"
Microsoft reportedly fires staff whose protest interrupted its Copilot event,https://techcrunch.com/2025/04/07/microsoft-reportedly-fires-staff-whose-protest-interrupted-its-copilot-event/,,"Apr 7, 2025"
Amazon says its AI video model can now generate minutes-long clips,https://techcrunch.com/2025/04/07/amazon-says-its-ai-video-model-can-now-generate-minutes-long-clips/,AI,"Apr 7, 2025"
How one tweet wreaked havoc on the stock market,https://techcrunch.com/2025/04/07/how-one-tweet-wreaked-havoc-on-the-stock-market/,Social,"Apr 7, 2025"
Nikola founder Trevor Milton wants to buy the bankrupt startup’s assets,https://techcrunch.com/2025/04/07/nikola-founder-trevor-milton-wants-to-buy-the-bankrupt-startups-assets/,Transportation,"Apr 7, 2025"
Flexport CEO Ryan Petersen’s high-stakes test amid tariff turmoil: ‘You can’t be freaking out’,https://techcrunch.com/2025/04/07/flexport-ceo-ryan-petersens-high-stakes-test-amid-tariff-turmoil-you-cant-be-freaking-out/,Startups,"Apr 7, 2025"
Meta exec denies the company artificially boosted Llama 4’s benchmark scores,https://techcrunch.com/2025/04/07/meta-exec-denies-the-company-artificially-boosted-llama-4s-benchmark-scores/,AI,"Apr 7, 2025"
"Analyst says Apple, Tesla have biggest exposure to Trump’s tariffs",https://techcrunch.com/2025/04/07/analyst-says-apple-tesla-have-biggest-exposure-to-trumps-tariffs/,Transportation,"Apr 7, 2025"
Former Tesla exec Drew Baglino’s new startup is rethinking the electrical transformer,https://techcrunch.com/2025/04/07/former-tesla-exec-drew-baglinos-new-startup-is-rethinking-the-electrical-transformer/,Climate,"Apr 7, 2025"
Google’s AI Mode now lets users ask complex questions about images,https://techcrunch.com/2025/04/07/googles-ai-mode-now-lets-users-ask-complex-questions-about-images/,AI,"Apr 7, 2025"
Shopify CEO tells teams to consider using AI before growing headcount,https://techcrunch.com/2025/04/07/shopify-ceo-tells-teams-to-consider-using-ai-before-growing-headcount/,AI,"Apr 7, 2025"
Google’s DeepMind UK team reportedly seeks to unionize,https://techcrunch.com/2025/04/26/googles-deepmind-uk-team-reportedly-seeks-to-unionize/,,
Google will stop supporting early Nest thermostats on October 25,https://techcrunch.com/2025/04/26/google-will-stop-supporting-early-nest-thermostats-on-october-25/,,
The OpenAI mafia: 15 of the most notable startups founded by alumni,https://techcrunch.com/2025/04/26/the-openai-mafia-15-of-the-most-notable-startups-founded-by-alumni/,,
An OpenAI researcher who worked on GPT-4.5 had their green card denied,https://techcrunch.com/2025/04/25/an-openai-researcher-who-worked-on-gpt-4-5-had-their-green-card-denied/,,
Bezos-backed Slate Auto debuts analog EV pickup truck that is decidedly anti-Tesla,https://techcrunch.com/2025/04/24/bezos-backed-slate-auto-debuts-analog-ev-pickup-truck-that-is-decidedly-anti-tesla/,,
"Wait, how did a decentralized service like Bluesky go down?",https://techcrunch.com/2025/04/24/wait-how-did-a-decentralized-service-like-bluesky-go-down/,,
Perplexity CEO says its browser will track everything users do online to sell ‘hyper personalized’ ads,https://techcrunch.com/2025/04/24/perplexity-ceo-says-its-browser-will-track-everything-users-do-online-to-sell-hyper-personalized-ads/,,
IBM acquires Hakkoda to continue its AI consultancy investment push,https://techcrunch.com/2025/04/07/ibm-acquires-consultancy-hakkoda-as-it-continues-its-ai-investment-push/,AI,"Apr 7, 2025"
SignalFire raises over $1B as LPs embrace data-driven investing,https://techcrunch.com/2025/04/07/signalfire-raises-over-1b-as-lps-embrace-data-driven-investing/,Venture,"Apr 7, 2025"
OpenAI reportedly mulls buying Jony Ive and Sam Altman’s AI hardware startup,https://techcrunch.com/2025/04/07/openai-reportedly-mulls-buying-jony-ive-and-sam-altmans-ai-hardware-startup/,,"Apr 7, 2025"
Someone hacked ransomware gang Everest’s leak site,https://techcrunch.com/2025/04/07/someone-hacked-everest-ransomware-gang-dark-web-leak-site/,Security,"Apr 7, 2025"
Want to stay young? Peter Diamandis says survive the next 10 years,https://techcrunch.com/2025/04/06/want-to-stay-young-peter-diamandis-says-survive-the-next-10-years/,Biotech & Health,"Apr 6, 2025"
Meta’s benchmarks for its new AI models are a bit misleading,https://techcrunch.com/2025/04/06/metas-benchmarks-for-its-new-ai-models-are-a-bit-misleading/,AI,"Apr 6, 2025"
BBC seeks more prominent credit in Apple and Google News,https://techcrunch.com/2025/04/06/bbc-seeks-more-prominent-credit-in-apple-and-google-news/,,"Apr 6, 2025"
White House reportedly blames auto-suggested iPhone contact for Signal scandal,https://techcrunch.com/2025/04/06/white-house-reportedly-blames-auto-suggested-iphone-contact-for-signal-scandal/,,"Apr 6, 2025"
"Microsoft releases AI-generated Quake II demo, but admits ‘limitations’",https://techcrunch.com/2025/04/06/microsoft-releases-ai-generated-quake-ii-demo-but-admits-limitations/,AI,"Apr 6, 2025"
DOGE reportedly planning a hackathon to build ‘mega API’ for IRS data,https://techcrunch.com/2025/04/05/doge-reportedly-planning-a-hackathon-to-build-mega-api-for-irs-data/,,"Apr 5, 2025"
"Meta releases Llama 4, a new crop of flagship AI models",https://techcrunch.com/2025/04/05/meta-releases-llama-4-a-new-crop-of-flagship-ai-models/,AI,"Apr 5, 2025"
Deel’s comms chief departs amidst spying lawsuit from Rippling,https://techcrunch.com/2025/04/05/deels-comms-chief-departs-amidst-spying-lawsuit-from-rippling/,Startups,"Apr 5, 2025"
‘A Minecraft Movie’ is on track for a $135M opening weekend,https://techcrunch.com/2025/04/05/a-minecraft-movie-is-on-track-for-a-135m-opening-weekend/,Media & Entertainment,"Apr 5, 2025"
Week in Review: Nintendo unveils the Switch 2,https://techcrunch.com/2025/04/05/nintendo-unveils-the-switch-2/,Social,"Apr 5, 2025"
SF mayor Daniel Lurie to tech CEOs: ‘How can we get you back?’,https://techcrunch.com/2025/04/05/sf-mayor-daniel-lurie-to-tech-ceos-how-can-we-get-you-back/,Government & Policy,"Apr 5, 2025"
"ChatGPT adoption skyrockets in India, but monetization may be trailing",https://techcrunch.com/2025/04/04/chatgpt-adoption-skyrockets-in-india-but-monetization-may-be-trailing/,AI,"Apr 4, 2025"
"TechCrunch Mobility: Tesla takes a hit, tariff chaos begins, and one EV startup hits a milestone",https://techcrunch.com/2025/04/04/techcrunch-mobility-tesla-takes-a-hit-tariff-chaos-begins-and-one-ev-startup-hits-a-milestone/,Transportation,"Apr 4, 2025"
How Kalshi helped prediction markets go mainstream,https://techcrunch.com/video/how-kalshi-helped-prediction-markets-go-mainstream/,Venture,"Apr 4, 2025"
"OpenAI’s models ‘memorized’ copyrighted content, new study suggests",https://techcrunch.com/2025/04/04/openais-models-memorized-copyrighted-content-new-study-suggests/,AI,"Apr 4, 2025"
"AI has opened a new era in venture capital, according to Forerunner founder Kirsten Green",https://techcrunch.com/video/ai-has-opened-a-new-era-in-venture-capital-according-to-forerunner-founder-kirsten-green/,Venture,"Apr 4, 2025"
Google will stop supporting early Nest thermostats on October 25,https://techcrunch.com/2025/04/26/google-will-stop-supporting-early-nest-thermostats-on-october-25/,,
The OpenAI mafia: 15 of the most notable startups founded by alumni,https://techcrunch.com/2025/04/26/the-openai-mafia-15-of-the-most-notable-startups-founded-by-alumni/,,
Musk’s xAI Holdings is reportedly raising the second-largest private funding round ever,https://techcrunch.com/2025/04/25/musks-xai-holdings-is-reportedly-raising-the-second-largest-private-funding-round-ever/,,
An OpenAI researcher who worked on GPT-4.5 had their green card denied,https://techcrunch.com/2025/04/25/an-openai-researcher-who-worked-on-gpt-4-5-had-their-green-card-denied/,,
Bezos-backed Slate Auto debuts analog EV pickup truck that is decidedly anti-Tesla,https://techcrunch.com/2025/04/24/bezos-backed-slate-auto-debuts-analog-ev-pickup-truck-that-is-decidedly-anti-tesla/,,
"Wait, how did a decentralized service like Bluesky go down?",https://techcrunch.com/2025/04/24/wait-how-did-a-decentralized-service-like-bluesky-go-down/,,
Perplexity CEO says its browser will track everything users do online to sell ‘hyper personalized’ ads,https://techcrunch.com/2025/04/24/perplexity-ceo-says-its-browser-will-track-everything-users-do-online-to-sell-hyper-personalized-ads/,,
"TechCrunch Mobility: Tesla takes a hit, tariff chaos begins, and one EV startup hits a milestone",https://techcrunch.com/2025/04/04/techcrunch-mobility-tesla-takes-a-hit-tariff-chaos-begins-and-one-ev-startup-hits-a-milestone/,Transportation,"Apr 4, 2025"
How Kalshi helped prediction markets go mainstream,https://techcrunch.com/video/how-kalshi-helped-prediction-markets-go-mainstream/,Venture,"Apr 4, 2025"
"OpenAI’s models ‘memorized’ copyrighted content, new study suggests",https://techcrunch.com/2025/04/04/openais-models-memorized-copyrighted-content-new-study-suggests/,AI,"Apr 4, 2025"
"AI has opened a new era in venture capital, according to Forerunner founder Kirsten Green",https://techcrunch.com/video/ai-has-opened-a-new-era-in-venture-capital-according-to-forerunner-founder-kirsten-green/,Venture,"Apr 4, 2025"
DeepSeek: Everything you need to know about the AI chatbot app,https://techcrunch.com/2025/04/04/deepseek-everything-you-need-to-know-about-the-ai-chatbot-app/,AI,"Apr 4, 2025"
Meta officially says goodbye to its US fact-checkers on Monday,https://techcrunch.com/2025/04/04/meta-officially-says-goodbye-to-its-us-fact-checkers-on-monday/,Social,"Apr 4, 2025"
Mach CEO on building defense tech company in your 20s,https://techcrunch.com/video/mach-ceo-on-building-defense-tech-company-in-your-20s/,Startups,"Apr 4, 2025"
"GitHub Copilot introduces new limits, charges for ‘premium’ AI models",https://techcrunch.com/2025/04/04/github-copilot-introduces-new-limits-charges-for-premium-ai-models/,AI,"Apr 4, 2025"
Trump extends TikTok ban deadline by 75 days,https://techcrunch.com/2025/04/04/trump-extends-tiktok-ban-deadline-by-75-days/,Social,"Apr 4, 2025"
Beyond Bluesky: These are the apps building social experiences on the AT Protocol,https://techcrunch.com/2025/04/04/beyond-bluesky-these-are-the-apps-building-social-experiences-on-the-at-protocol/,Social,"Apr 4, 2025"
"Protester interrupts Microsoft Copilot keynote, says company has ‘blood on its hands’",https://techcrunch.com/2025/04/04/protester-interrupts-microsoft-copilot-keynote-says-company-has-blood-on-its-hands/,,"Apr 4, 2025"
San Francisco Mayor Daniel Lurie thinks his city is on the verge of a rebound,https://techcrunch.com/video/san-francisco-mayor-daniel-lurie-thinks-his-city-is-on-the-verge-of-a-rebound/,Government & Policy,"Apr 4, 2025"
Startups Weekly: Stay tuned for the Rippling espionage movie,https://techcrunch.com/2025/04/04/startups-weekly-stay-tuned-for-the-rippling-espionage-movie/,Startups,"Apr 4, 2025"
Flexport CEO Ryan Petersen still sees opportunity in global trade despite Trump’s tariffs,https://techcrunch.com/video/flexport-ceo-ryan-petersen-still-sees-opportunity-in-global-trade-despite-trumps-tariffs/,Government & Policy,"Apr 4, 2025"
Gemini 2.5 Pro is Google’s most expensive AI model yet,https://techcrunch.com/2025/04/04/gemini-2-5-pro-is-googles-most-expensive-ai-model-yet/,AI,"Apr 4, 2025"
Klarna and StubHub delay IPOs because of Trump tariff turmoil,https://techcrunch.com/2025/04/04/klarna-and-stubhub-delay-ipos-because-of-trump-tariff-turmoil/,,"Apr 4, 2025"
Microsoft’s Copilot can now browse the web and perform actions for you,https://techcrunch.com/2025/04/04/microsofts-copilot-can-now-browse-the-web-and-perform-actions-for-you/,AI,"Apr 4, 2025"
Spy games in HR tech: Inside Rippling’s wild lawsuit against Deel,https://techcrunch.com/podcast/spy-games-in-hr-tech-inside-ripplings-wild-lawsuit-against-deel/,Startups,"Apr 4, 2025"
Turbine raises $22M to help VC investors get cash without selling their stakes,https://techcrunch.com/2025/04/04/turbine-raises-22m-to-help-vc-investors-get-cash-without-selling-their-stakes/,Fintech,"Apr 4, 2025"
Nintendo delays Switch 2 preorders in response to tariffs,https://techcrunch.com/2025/04/04/nintendo-delays-switch-2-preorders-in-response-to-tariffs/,Gaming,"Apr 4, 2025"
Google’s DeepMind UK team reportedly seeks to unionize,https://techcrunch.com/2025/04/26/googles-deepmind-uk-team-reportedly-seeks-to-unionize/,,
Google will stop supporting early Nest thermostats on October 25,https://techcrunch.com/2025/04/26/google-will-stop-supporting-early-nest-thermostats-on-october-25/,,
