title,link,category,published_time
"Welcome to Chat Haus, the coworking space for AI chatbots",https://techcrunch.com/2025/04/27/welcome-to-chat-haus-the-coworking-space-for-ai-chatbots/,AI,58 minutes ago
Report finds Meta’s celebrity-voiced chatbots could discuss sex with minors,https://techcrunch.com/2025/04/27/report-finds-metas-celebrity-voiced-chatbots-could-discuss-sex-with-minors/,,2 hours ago
Best bookmarking apps to help organize and declutter your digital life,https://techcrunch.com/2025/04/27/best-bookmarking-apps-to-help-organize-and-declutter-your-digital-life/,Apps,2 hours ago
Here are Latin America’s biggest startups based on valuation,https://techcrunch.com/2025/04/27/here-are-latin-americas-biggest-startups-based-on-valuation/,Startups,3 hours ago
The RealReal founder Julie Wainwright has a startling new memoir,https://techcrunch.com/2025/04/26/the-realreal-founder-julie-wainwright-has-a-startling-new-memoir/,Commerce,19 hours ago
Google’s DeepMind UK team reportedly seeks to unionize,https://techcrunch.com/2025/04/26/googles-deepmind-uk-team-reportedly-seeks-to-unionize/,,20 hours ago
Google will stop supporting early Nest thermostats on October 25,https://techcrunch.com/2025/04/26/google-will-stop-supporting-early-nest-thermostats-on-october-25/,,22 hours ago
Week in Review: Cluely helps you cheat on everything,https://techcrunch.com/2025/04/26/week-in-review-cluely-helps-you-cheat-on-everything/,Social,24 hours ago
Amazon’s big book sale just happens to overlap with Independent Bookstore Day,https://techcrunch.com/2025/04/26/amazons-big-book-sale-just-happens-to-overlap-with-independent-bookstore-day/,Commerce,1 day ago
Government officials are kind of bad at the internet,https://techcrunch.com/2025/04/26/government-officials-are-kind-of-bad-at-the-internet/,Government & Policy,1 day ago
Lately’s new gamified app helps people arrive on time,https://techcrunch.com/2025/04/26/latelys-new-gamified-app-helps-people-arrive-on-time/,Apps,1 day ago
The OpenAI mafia: 15 of the most notable startups founded by alumni,https://techcrunch.com/2025/04/26/the-openai-mafia-15-of-the-most-notable-startups-founded-by-alumni/,Startups,1 day ago
"Instagram Edits topped 7M downloads in first week, a bigger launch than CapCut’s",https://techcrunch.com/2025/04/26/instagram-edits-topped-7m-downloads-in-first-week-a-bigger-launch-than-capcuts/,Apps,1 day ago
Musk’s xAI Holdings is reportedly raising the second-largest private funding round ever,https://techcrunch.com/2025/04/25/musks-xai-holdings-is-reportedly-raising-the-second-largest-private-funding-round-ever/,,1 day ago
DoorDash seeks dismissal of Uber lawsuit,https://techcrunch.com/2025/04/25/doordash-seeks-dismissal-of-uber-lawsuit/,Transportation,2 days ago
TechCrunch Mobility: Slate’s ‘transformer’ EV truck breaks cover and Tesla’s dueling realities,https://techcrunch.com/2025/04/25/techcrunch-mobility-slates-transformer-ev-truck-breaks-cover-and-teslas-dueling-realities/,Transportation,2 days ago
Anthropic sent a takedown notice to a dev trying to reverse-engineer its coding tool,https://techcrunch.com/2025/04/25/anthropic-sent-a-takedown-notice-to-a-dev-trying-to-reverse-engineer-its-coding-tool/,AI,2 days ago
Deel files countersuit against Rippling as rivalry escalates,https://techcrunch.com/2025/04/25/deel-files-countersuit-against-rippling-as-rivalry-escalates/,Startups,2 days ago
Slate Auto eyes former Indiana printing plant for its EV truck production,https://techcrunch.com/2025/04/25/slate-auto-eyes-former-indiana-printing-plant-for-its-ev-truck-production/,Transportation,2 days ago
TechCrunch StrictlyVC in Athens in May will feature a special guest: Greece’s prime minister,https://techcrunch.com/2025/04/25/techcrunch-strictlyvc-in-athens-will-feature-a-special-guest-the-greek-prime-minister/,StrictlyVC Greece,2 days ago
Google’s DeepMind UK team reportedly seeks to unionize,https://techcrunch.com/2025/04/26/googles-deepmind-uk-team-reportedly-seeks-to-unionize/,,
Google will stop supporting early Nest thermostats on October 25,https://techcrunch.com/2025/04/26/google-will-stop-supporting-early-nest-thermostats-on-october-25/,,
The OpenAI mafia: 15 of the most notable startups founded by alumni,https://techcrunch.com/2025/04/26/the-openai-mafia-15-of-the-most-notable-startups-founded-by-alumni/,,
An OpenAI researcher who worked on GPT-4.5 had their green card denied,https://techcrunch.com/2025/04/25/an-openai-researcher-who-worked-on-gpt-4-5-had-their-green-card-denied/,,
Bezos-backed Slate Auto debuts analog EV pickup truck that is decidedly anti-Tesla,https://techcrunch.com/2025/04/24/bezos-backed-slate-auto-debuts-analog-ev-pickup-truck-that-is-decidedly-anti-tesla/,,
"Wait, how did a decentralized service like Bluesky go down?",https://techcrunch.com/2025/04/24/wait-how-did-a-decentralized-service-like-bluesky-go-down/,,
Perplexity CEO says its browser will track everything users do online to sell ‘hyper personalized’ ads,https://techcrunch.com/2025/04/24/perplexity-ceo-says-its-browser-will-track-everything-users-do-online-to-sell-hyper-personalized-ads/,,
The TechCrunch Cyber Glossary,https://techcrunch.com/2025/04/25/techcrunch-reference-guide-to-security-terminology/,Security,2 days ago
ChatGPT: Everything you need to know about the AI-powered chatbot,https://techcrunch.com/2025/04/25/chatgpt-everything-to-know-about-the-ai-chatbot/,AI,2 days ago
"Startups Weekly: Tech IPOs and deals proceed, but price matters",https://techcrunch.com/2025/04/25/startups-weekly-tech-ipos-and-deals-proceed-but-price-matters/,Startups,2 days ago
An OpenAI researcher who worked on GPT-4.5 had their green card denied,https://techcrunch.com/2025/04/25/an-openai-researcher-who-worked-on-gpt-4-5-had-their-green-card-denied/,AI,2 days ago
Big Tech’s antitrust cases are starting to feel like Groundhog Day,https://techcrunch.com/podcast/big-techs-antitrust-cases-are-starting-to-feel-like-groundhog-day/,Enterprise,2 days ago
"Google’s AI search numbers are growing, and that’s by design",https://techcrunch.com/2025/04/25/googles-ai-search-numbers-are-growing-and-thats-by-design/,AI,2 days ago
"Roelof Botha, the head of Sequoia Capital, is coming to TechCrunch Disrupt 2025",https://techcrunch.com/2025/04/25/roelof-botha-the-head-of-sequoia-capital-is-coming-to-techcrunch-disrupt-2025/,TechCrunch Disrupt 2025,2 days ago
Last day to boost your brand and host a Side Event at TechCrunch Sessions: AI,https://techcrunch.com/2025/04/25/last-day-to-boost-your-brand-and-host-a-side-event-at-techcrunch-sessions-ai/,TC Sessions: AI,2 days ago
"Prince Harry meets, funds youth groups advocating for social media and AI safety",https://techcrunch.com/2025/04/25/prince-harry-meets-funds-youth-advocating-for-social-media-and-ai-safety/,Social,2 days ago
Chinese AI startup Manus reportedly gets funding from Benchmark at $500M valuation,https://techcrunch.com/2025/04/25/chinese-ai-startup-manus-reportedly-gets-funding-from-benchmark-at-500m-valuation/,,2 days ago
Data breach at Connecticut’s Yale New Haven Health affects over 5 million,https://techcrunch.com/2025/04/25/data-breach-at-connecticut-yale-new-haven-health-affects-over-5-million/,Security,2 days ago
Bezos-backed Slate Auto debuts analog EV pickup truck that is decidedly anti-Tesla,https://techcrunch.com/2025/04/24/bezos-backed-slate-auto-debuts-analog-ev-pickup-truck-that-is-decidedly-anti-tesla/,Transportation,3 days ago
Faraday Future founder named co-CEO three years after being sidelined by internal probe,https://techcrunch.com/2025/04/24/faraday-future-founder-named-co-ceo-three-years-after-being-sidelined-by-internal-probe/,Transportation,3 days ago
"Wait, how did a decentralized service like Bluesky go down?",https://techcrunch.com/2025/04/24/wait-how-did-a-decentralized-service-like-bluesky-go-down/,Social,3 days ago
Anthropic CEO wants to open the black box of AI models by 2027,https://techcrunch.com/2025/04/24/anthropic-ceo-wants-to-open-the-black-box-of-ai-models-by-2027/,AI,3 days ago
How do you define cheating in the age of AI?,https://techcrunch.com/video/how-do-you-define-cheating-in-the-age-of-ai/,AI,3 days ago
OpenAI rolls out a ‘lightweight’ version of its ChatGPT deep research tool,https://techcrunch.com/2025/04/24/openai-rolls-out-a-lightweight-version-of-its-chatgpt-deep-research-tool/,AI,3 days ago
Perplexity CEO says its browser will track everything users do online to sell ‘hyper personalized’ ads,https://techcrunch.com/2025/04/24/perplexity-ceo-says-its-browser-will-track-everything-users-do-online-to-sell-hyper-personalized-ads/,AI,3 days ago
"Intel reverses course, opts not to spin out Intel Capital",https://techcrunch.com/2025/04/24/intel-reverses-course-opts-not-to-spin-out-intel-capital/,Venture,3 days ago
Intel mandates four days in the office,https://techcrunch.com/2025/04/24/intel-mandates-four-days-in-the-office/,Enterprise,3 days ago
Google’s DeepMind UK team reportedly seeks to unionize,https://techcrunch.com/2025/04/26/googles-deepmind-uk-team-reportedly-seeks-to-unionize/,,
Google will stop supporting early Nest thermostats on October 25,https://techcrunch.com/2025/04/26/google-will-stop-supporting-early-nest-thermostats-on-october-25/,,
The OpenAI mafia: 15 of the most notable startups founded by alumni,https://techcrunch.com/2025/04/26/the-openai-mafia-15-of-the-most-notable-startups-founded-by-alumni/,,
An OpenAI researcher who worked on GPT-4.5 had their green card denied,https://techcrunch.com/2025/04/25/an-openai-researcher-who-worked-on-gpt-4-5-had-their-green-card-denied/,,
Bezos-backed Slate Auto debuts analog EV pickup truck that is decidedly anti-Tesla,https://techcrunch.com/2025/04/24/bezos-backed-slate-auto-debuts-analog-ev-pickup-truck-that-is-decidedly-anti-tesla/,,
"Wait, how did a decentralized service like Bluesky go down?",https://techcrunch.com/2025/04/24/wait-how-did-a-decentralized-service-like-bluesky-go-down/,,
Perplexity CEO says its browser will track everything users do online to sell ‘hyper personalized’ ads,https://techcrunch.com/2025/04/24/perplexity-ceo-says-its-browser-will-track-everything-users-do-online-to-sell-hyper-personalized-ads/,,
"Public comments to White House on AI policy touch on copyright, tariffs",https://techcrunch.com/2025/04/24/public-comments-to-white-house-on-ai-policy-touch-on-copyright-tariffs/,AI,3 days ago
Astro Teller is joining us at TechCrunch Disrupt 2025 in October,https://techcrunch.com/2025/04/24/astro-teller-is-joining-us-at-techcrunch-disrupt-2025-in-october/,TechCrunch Disrupt 2025,3 days ago
"Evernote founder’s video startup mmhmm becomes Airtime, launches new products",https://techcrunch.com/2025/04/24/evernote-founders-video-startup-mmhmm-becomes-airtime-launches-new-products/,Startups,3 days ago
"Report: Adam Neumann’s Flow raises $100M+, more than doubles valuation to $2.5B",https://techcrunch.com/2025/04/24/report-adam-neumanns-flow-raises-100m-more-than-doubles-valuation-to-2-5b/,,3 days ago
OpenAI wants its ‘open’ AI model to call models in the cloud for help,https://techcrunch.com/2025/04/24/openai-wants-its-open-ai-model-to-call-models-in-the-cloud-for-help/,AI,3 days ago
"OpenAI may be developing its own social platform, but who’s it for?",https://techcrunch.com/video/openai-may-be-developing-its-own-social-platform-but-whos-it-for/,AI,3 days ago
You’re invited to a fireside chat with Baiju Bhatt on Sand Hill Road on June 18 at StrictlyVC,https://techcrunch.com/2025/04/24/youre-invited-to-a-fireside-chat-with-baiju-bhatt-on-sand-hill-road-on-june-18-at-strictlyvc/,StrictlyVC Menlo Park,3 days ago
"Meta conducts layoffs in Oculus Studios, impacting VR exercise app Supernatural",https://techcrunch.com/2025/04/24/meta-conducts-layoffs-in-oculus-studios-impacting-vr-exercise-app-supernatural/,Social,3 days ago
Parents who lost children to online harms protest outside of Meta’s NYC office,https://techcrunch.com/2025/04/24/parents-who-lost-children-to-online-harms-protest-outside-of-metas-nyc-office/,Social,3 days ago
Threads officially moves to Threads.com and updates its web app,https://techcrunch.com/2025/04/24/threads-officially-moves-to-threads-com-and-updates-its-web-app/,Social,3 days ago
Pope Francis’ funeral to stream on YouTube,https://techcrunch.com/2025/04/24/pope-francis-funeral-to-stream-on-youtube/,,3 days ago
Flex acquires a16z-backed Maza for $40M as fintech M&A heats up,https://techcrunch.com/2025/04/24/flex-acquires-a16z-backed-maza-for-40m-as-fintech-ma-heats-up/,Startups,3 days ago
"Within six years, building the leading AI data center may cost $200B",https://techcrunch.com/2025/04/24/within-six-years-building-the-leading-ai-data-center-may-cost-200b/,AI,3 days ago
Mark Zuckerberg really wants to make Facebook cool again,https://techcrunch.com/video/mark-zuckerberg-really-wants-to-make-facebook-cool-again/,Apps,3 days ago
Netflix now offers dialogue-only subtitles,https://techcrunch.com/2025/04/24/netflix-now-offers-dialogue-only-subtitles/,Media & Entertainment,3 days ago
Chess.com reaches 200 million members,https://techcrunch.com/2025/04/24/chess-com-reaches-200-million-members/,Gaming,3 days ago
Facebook cracks down on spammy content by cutting reach and monetization,https://techcrunch.com/2025/04/24/facebook-cracks-down-on-spammy-content-by-cutting-reach-and-monetization/,Apps,3 days ago
TikTok adds support for ALT text for photos,https://techcrunch.com/2025/04/24/tiktok-adds-support-for-alt-text-for-photos/,,3 days ago
Anthropic is launching a new program to study AI ‘model welfare’,https://techcrunch.com/2025/04/24/anthropic-is-launching-a-new-program-to-study-ai-model-welfare/,AI,3 days ago
Spotify’s AI playlist rolls out to Asia and more markets,https://techcrunch.com/2025/04/24/spotifys-ai-playlist-rolls-out-to-asia-and-more-markets/,Apps,3 days ago
Google’s DeepMind UK team reportedly seeks to unionize,https://techcrunch.com/2025/04/26/googles-deepmind-uk-team-reportedly-seeks-to-unionize/,,
Google will stop supporting early Nest thermostats on October 25,https://techcrunch.com/2025/04/26/google-will-stop-supporting-early-nest-thermostats-on-october-25/,,
The OpenAI mafia: 15 of the most notable startups founded by alumni,https://techcrunch.com/2025/04/26/the-openai-mafia-15-of-the-most-notable-startups-founded-by-alumni/,,
An OpenAI researcher who worked on GPT-4.5 had their green card denied,https://techcrunch.com/2025/04/25/an-openai-researcher-who-worked-on-gpt-4-5-had-their-green-card-denied/,,
Bezos-backed Slate Auto debuts analog EV pickup truck that is decidedly anti-Tesla,https://techcrunch.com/2025/04/24/bezos-backed-slate-auto-debuts-analog-ev-pickup-truck-that-is-decidedly-anti-tesla/,,
"Wait, how did a decentralized service like Bluesky go down?",https://techcrunch.com/2025/04/24/wait-how-did-a-decentralized-service-like-bluesky-go-down/,,
Perplexity CEO says its browser will track everything users do online to sell ‘hyper personalized’ ads,https://techcrunch.com/2025/04/24/perplexity-ceo-says-its-browser-will-track-everything-users-do-online-to-sell-hyper-personalized-ads/,,
Speak at TechCrunch Disrupt 2025: Applications now open,https://techcrunch.com/2025/04/24/speak-at-techcrunch-disrupt-2025-applications-now-open/,TechCrunch Disrupt 2025,3 days ago
RepAir Carbon is making carbon removal machines inspired by batteries,https://techcrunch.com/2025/04/24/repair-carbon-is-making-carbon-removal-machines-inspired-by-batteries/,Climate,3 days ago
"Founders, your moment is now: Apply for TechCrunch Startup Battlefield 200",https://techcrunch.com/2025/04/24/founders-your-moment-is-now-apply-for-startup-battlefield-200/,TechCrunch Disrupt 2025,3 days ago
"Revolut, the $45B neobank, posts $1B profit in 2024",https://techcrunch.com/2025/04/24/revolut-the-45b-neobank-posts-1b-profit-in-2024/,Fintech,3 days ago
"Dropbox adds new features to Dash, its AI-powered search tool",https://techcrunch.com/2025/04/24/dropbox-adds-new-features-to-its-ai-powered-search-tool-dash/,Apps,3 days ago
"Uber, Volkswagen pair up to launch robotaxi service in US with self-driving, electric microbuses",https://techcrunch.com/2025/04/24/uber-and-volkswagen-pair-up-to-launch-robotaxi-service-with-self-driving-electric-microbuses/,Transportation,3 days ago
This tool estimates how much electricity your chatbot messages consume,https://techcrunch.com/2025/04/24/this-tool-estimates-how-much-electricity-your-chatbot-messages-consume/,AI,3 days ago
British startup Isembard lands $9M to reshore manufacturing for critical industries,https://techcrunch.com/2025/04/24/british-startup-isembard-lands-9m-to-reshore-manufacturing-for-critical-industries/,Startups,3 days ago
Adobe wants to create a robots.txt-styled indicator for images used in AI training,https://techcrunch.com/2025/04/24/adobe-wants-to-create-a-robots-txt-styled-indicator-for-images-used-in-ai-training/,Apps,3 days ago
Adobe releases new Firefly image generation models and a redesigned Firefly web app,https://techcrunch.com/2025/04/24/adobe-releases-new-firefly-image-generation-models-and-a-redesigned-firefly-web-app/,AI,3 days ago
Mystery will may reveal Zappos founder’s final wishes,https://techcrunch.com/2025/04/23/mystery-will-may-reveal-zappos-founders-final-wishes/,,4 days ago
"IBM affected by DOGE cuts, downplays impact during Q1 earnings call",https://techcrunch.com/2025/04/23/ibm-affected-by-doge-cuts-downplays-impact-during-q1-earnings-call/,Enterprise,4 days ago
Windsurf slashes prices as competition with Cursor heats up,https://techcrunch.com/2025/04/23/windsurf-slashes-prices-as-competition-with-cursor-heats-up/,Startups,4 days ago
"Tesla begins ‘FSD Supervised’ ride-hail tests with employees in Austin, Bay Area",https://techcrunch.com/2025/04/23/tesla-begins-fsd-supervised-ride-hail-tests-with-employees-in-austin-bay-area/,Transportation,4 days ago
"Government censorship comes to Bluesky, but not its third-party apps … yet",https://techcrunch.com/2025/04/23/government-censorship-comes-to-bluesky-but-not-its-third-party-apps-yet/,Social,4 days ago
OpenAI seeks to make its upcoming ‘open’ AI model best-in-class,https://techcrunch.com/2025/04/23/openai-seeks-to-make-its-upcoming-open-ai-model-best-in-class/,AI,4 days ago
Here are the 19 US AI startups that have raised $100M or more in 2025,https://techcrunch.com/2025/04/23/here-are-the-19-us-ai-startups-that-have-raised-100m-or-more-in-2025/,AI,4 days ago
"Netflix aims to be a trillion-dollar company, says co-CEO",https://techcrunch.com/2025/04/23/netflix-aims-to-be-a-trillion-dollar-company-says-co-ceo/,,4 days ago
19 US fintech startups have raised over $50M in 2025 so far,https://techcrunch.com/2025/04/23/19-us-fintech-startups-have-raised-over-50m-in-2025-so-far/,Fintech,4 days ago
Discord appoints former Activision Blizzard exec Humam Sakhnini as CEO,https://techcrunch.com/2025/04/23/discord-appoints-former-activision-blizzard-exec-humam-sakhnini-as-ceo/,Gaming,4 days ago
Google’s DeepMind UK team reportedly seeks to unionize,https://techcrunch.com/2025/04/26/googles-deepmind-uk-team-reportedly-seeks-to-unionize/,,
Google will stop supporting early Nest thermostats on October 25,https://techcrunch.com/2025/04/26/google-will-stop-supporting-early-nest-thermostats-on-october-25/,,
The OpenAI mafia: 15 of the most notable startups founded by alumni,https://techcrunch.com/2025/04/26/the-openai-mafia-15-of-the-most-notable-startups-founded-by-alumni/,,
An OpenAI researcher who worked on GPT-4.5 had their green card denied,https://techcrunch.com/2025/04/25/an-openai-researcher-who-worked-on-gpt-4-5-had-their-green-card-denied/,,
Bezos-backed Slate Auto debuts analog EV pickup truck that is decidedly anti-Tesla,https://techcrunch.com/2025/04/24/bezos-backed-slate-auto-debuts-analog-ev-pickup-truck-that-is-decidedly-anti-tesla/,,
"Wait, how did a decentralized service like Bluesky go down?",https://techcrunch.com/2025/04/24/wait-how-did-a-decentralized-service-like-bluesky-go-down/,,
Perplexity CEO says its browser will track everything users do online to sell ‘hyper personalized’ ads,https://techcrunch.com/2025/04/24/perplexity-ceo-says-its-browser-will-track-everything-users-do-online-to-sell-hyper-personalized-ads/,,
OpenAI’s GPT-4.1 may be less aligned than the company’s previous AI models,https://techcrunch.com/2025/04/23/openais-gpt-4-1-may-be-less-aligned-than-the-companys-previous-ai-models/,AI,4 days ago
DOJ reportedly probes Disney-FuboTV deal over competition concerns,https://techcrunch.com/2025/04/23/doj-reportedly-probes-disney-fubotv-deal-over-competition-concerns/,,4 days ago
Anti-Musk protests are now an official risk to Tesla’s business,https://techcrunch.com/2025/04/23/anti-musk-protests-are-now-an-official-risk-to-teslas-business/,Transportation,4 days ago
OpenAI makes its upgraded image generator available to developers,https://techcrunch.com/2025/04/23/openai-makes-its-upgraded-image-generator-available-to-developers/,AI,4 days ago
"Google Gemini has 350M monthly users, reveals court hearing",https://techcrunch.com/2025/04/23/google-gemini-has-350m-monthly-users-reveals-court-hearing/,,4 days ago
Bring a plus-one to TechCrunch Sessions: AI and save 50% on their ticket through May 4,https://techcrunch.com/2025/04/23/bring-a-plus-one-to-techcrunch-sessions-ai-and-save-50-on-their-ticket-through-may-4/,TC Sessions: AI,4 days ago
Fluent Ventures backs replicated startup models in emerging markets,https://techcrunch.com/2025/04/23/fluent-ventures-backs-replicated-startup-models-in-emerging-markets/,Venture,4 days ago
"How to survive and thrive as tariffs, AI, and politics unsettle the rules of business",https://techcrunch.com/podcast/how-to-survive-and-thrive-as-tariffs-ai-and-politics-unsettle-the-rules-of-business/,Startups,4 days ago
Meta’s Threads opens up ads to global advertisers,https://techcrunch.com/2025/04/23/metas-threads-opens-up-ads-to-global-advertisers/,Social,4 days ago
Amazon’s Starlink competitor runs into production delays,https://techcrunch.com/2025/04/23/amazons-starlink-competitor-runs-into-production-delays/,,4 days ago
AI note-taking app Fireflies adds new ways to extract insights from meeting notes,https://techcrunch.com/2025/04/23/ai-powered-notetaker-fireflies-ai-release-mini-apps-to-extract-insights-out-of-meeting-notes/,Apps,4 days ago
WhatsApp’s latest feature makes your messages even more private,https://techcrunch.com/2025/04/23/whatsapps-latest-feature-makes-your-messages-even-more-private/,Apps,4 days ago
"EU fines Apple, Meta millions for breaching tech competition rules",https://techcrunch.com/2025/04/23/eu-fines-apple-meta-millions-for-breaching-tech-competition-rules/,Government & Policy,4 days ago
Durin digs up $3.4M to automate drills for critical minerals exploration,https://techcrunch.com/2025/04/23/durin-digs-up-3-4m-to-automate-drills-for-critical-minerals-exploration/,Robotics,4 days ago
Blue Shield of California shared the private health data of millions with Google for years,https://techcrunch.com/2025/04/23/blue-shield-of-california-shared-the-private-health-data-of-millions-with-google-for-years/,Security,4 days ago
Linktree rolls out a suite of monetization features for creators,https://techcrunch.com/2025/04/23/linktree-rolls-out-a-suite-of-monetization-features-for-creators/,Apps,4 days ago
"Endor Labs, which builds tools to scan AI-generated code for vulnerabilities, lands $93M",https://techcrunch.com/2025/04/23/endor-labs-which-builds-tools-to-scan-ai-generated-code-for-vulnerabilities-lands-93m/,Security,4 days ago
YouTube’s TV app is getting a redesign this summer,https://techcrunch.com/2025/04/23/youtube-adds-new-features-to-improve-playback-and-creator-experinces/,Apps,4 days ago
Datadog acquires AI-powered observability startup Metaplane,https://techcrunch.com/2025/04/23/datadog-acquires-ai-powered-observability-startup-metaplane/,Enterprise,4 days ago
Alpaca raises $52M Series C to take its API brokerage platform to new markets,https://techcrunch.com/2025/04/23/alpaca-a-developer-of-api-brokerage-platform-raises-52m-in-series-c/,Fintech,4 days ago
Google’s DeepMind UK team reportedly seeks to unionize,https://techcrunch.com/2025/04/26/googles-deepmind-uk-team-reportedly-seeks-to-unionize/,,
Google will stop supporting early Nest thermostats on October 25,https://techcrunch.com/2025/04/26/google-will-stop-supporting-early-nest-thermostats-on-october-25/,,
The OpenAI mafia: 15 of the most notable startups founded by alumni,https://techcrunch.com/2025/04/26/the-openai-mafia-15-of-the-most-notable-startups-founded-by-alumni/,,
An OpenAI researcher who worked on GPT-4.5 had their green card denied,https://techcrunch.com/2025/04/25/an-openai-researcher-who-worked-on-gpt-4-5-had-their-green-card-denied/,,
Bezos-backed Slate Auto debuts analog EV pickup truck that is decidedly anti-Tesla,https://techcrunch.com/2025/04/24/bezos-backed-slate-auto-debuts-analog-ev-pickup-truck-that-is-decidedly-anti-tesla/,,
"Wait, how did a decentralized service like Bluesky go down?",https://techcrunch.com/2025/04/24/wait-how-did-a-decentralized-service-like-bluesky-go-down/,,
Perplexity CEO says its browser will track everything users do online to sell ‘hyper personalized’ ads,https://techcrunch.com/2025/04/24/perplexity-ceo-says-its-browser-will-track-everything-users-do-online-to-sell-hyper-personalized-ads/,,
The US doesn’t refine cobalt — this startup wants to change that,https://techcrunch.com/2025/04/23/the-u-s-refines-zero-cobalt-this-startup-wants-to-change-that/,Climate,4 days ago
Cynomi cinches $37M for its AI-based ‘virtual CISO’ for SMB cybersecurity,https://techcrunch.com/2025/04/23/cynomi-cinches-37m-for-its-ai-based-virtual-ciso-for-smb-cybersecurity/,Security,4 days ago
